creationDate,orderId,categoryName,name,price,listPrice,quantity,productId,seller,data_extracao
2026-01-14 21:42:05,1603371154844-01,Celulares e Smartphones,Celular samsung galaxy a07 tela 6.7” 256gb 4g 90hz câmera dupla 50mp verde,77900,109900,1,2047276,loyalt,2026-01-19 16:26:34
2026-01-14 21:41:42,1603371154843-01,Fritadeiras Elétricas | Eletroportáteis,"Fritadeira air fryer electrolux eaf40 rita lobo 5,6l efficient 1400w antiaderente desligamento automático econômica cinza",32900,49900,1,2045302,loyalt,2026-01-19 16:26:34
2026-01-14 21:37:35,1603371154842-01,Mochilas | Bolsas e Mochilas,MOCHILA JUVENIL FEMININA RB PRETA ROSA RB24536 SEMAX,24999,24999,1,795735,minipreco,2026-01-19 16:26:34
2026-01-14 21:36:55,1603371154841-01,Pipoqueiras | Eletroportáteis,Pipoqueira Britânia Pop Time 127V,14990,25990,1,806,Philco,2026-01-19 16:26:34
2026-01-14 21:34:51,1603371154840-01,Carros de passeio | Pneus | Produtos automotivos,Pneu Aro 14 175/65R14 82T F-600 Firestone,31498,31498,4,817913,pneubarato,2026-01-19 16:26:35
2026-01-14 21:34:22,1603371154837-02,Cooktops | Fogões e Cooktops | Eletrodomésticos,Cooktop Atlas U Top 5 Bocas Acendimento Automático e Tripla Chama Preto Bivolt,54990,69990,1,136571,multilojaonline,2026-01-19 16:26:35
2026-01-14 21:34:22,1603371154837-01,Fornos de Micro-Ondas | Eletrodomésticos,Micro-ondas 33L Philco PMO38S Limpa Fácil 1400W 220V,76990,92990,1,1048529,Philco,2026-01-19 16:26:35
2026-01-14 21:16:52,1603361154827-01,"Multiprocessador | Liquidificadores, Batedeiras e Processadores | Eletroportáteis",Multiprocessador Britânia All In One BMP900P Preto 900W 127V,17990,41990,1,1895,Philco,2026-01-19 16:26:36
2026-01-14 21:16:52,1603361154826-01,Smartphone | Celulares e Smartphones,USADO Samsung Galaxy S24 Ultra 512 GB Titânio Preto Muito Bom,464800,464800,1,2535675,armazemcircular,2026-01-19 16:26:36
2026-01-14 21:16:52,1603361154827-02,"Talheres e Porta-Talheres | Louça, Copos e Talheres | Casa e Cozinha","Panela de Pressão Panelux Alumínio 4,5L Polida Classic PANELA DE PRESSAO PANELUX ALUMINIO 4,5L",6400,6400,1,733462,webcontinentalmktplace,2026-01-19 16:26:36
2026-01-14 21:13:34,1603361154822-01,"Cafeteiras e Máquinas de Expresso | Café, Chá e Expresso | Eletroportáteis",Cafeteira elétrica mondial dolce arome vidro c-43-20x-si 20 xícaras 550w – preto/inox,14990,14990,1,2045074,loyalt,2026-01-19 16:26:36
2026-01-14 21:13:15,1603361154819-01,Facas de Cozinha e Acessórios | Panelas e Utensílios para Cozinhar | Casa e Cozinha,Jogo de Facas Tramontina Plenus Aço Inox e Cabos de Polipropileno Preto 04 Peças,3140,4990,1,708907,marinbrasil,2026-01-19 16:26:37
2026-01-14 21:13:15,1603361154819-02,Cobertores e Mantas | Cama e Banho | Casa e Cozinha,KIT CAMA CASAL MICROFIBRA SORTIDO 3PCS 138X188CM JSC7822AOES ANDREZA,5990,5990,1,1273032,minipreco,2026-01-19 16:26:37
2026-01-14 21:13:15,1603361154819-02,Potes | Utensílios para Cozinha | Casa e Cozinha,Pote Hermético Vidro Borossilicato Tampa 350ML - IMPORIENTE,1490,1490,1,828274,minipreco,2026-01-19 16:26:37
2026-01-14 21:13:15,1603361154819-03,Câmeras de Segurança | Sistemas de Segurança para Casa | Materiais de Construção,Mini Câmera Espiã A9 Wifi Sensor Visão Noturna,2925,2925,1,1687758,webcontinentalmktplace,2026-01-19 16:26:37
2026-01-14 21:07:50,1603361154816-01,Ferro de Passar e Passadeiras | Eletroportáteis,Ferro de passar cadence 2 em 1 cinza 110v,6990,8990,1,2052100,loyalt,2026-01-19 16:26:37
2026-01-14 21:05:33,1603361154814-01,Ferro de Passar e Passadeiras | Eletroportáteis,Ferro De Passar Cadence 2 Em 1 Cinza 110V,8990,8990,1,1777956,webcontinentalmktplace,2026-01-19 16:26:38
2026-01-14 21:03:57,1603361154813-01,Smartwatches | Eletrônicos,"Smartwatch Multi M2 Tela 1,78 Amoled Proteção IP67 Rosé - WR205 WR205",34900,34900,1,791465,compreja,2026-01-19 16:26:38
2026-01-14 21:02:38,1603361154812-01,Jogos | Brinquedos,Jogo Show do Milhão - PAIS E FILHOS,8990,8990,1,1725175,minipreco,2026-01-19 16:26:38
2026-01-14 21:02:18,1603361154811-01,"Liquidificadores | Liquidificadores, Batedeiras e Processadores | Eletroportáteis",Liquidificador mondial easy power l-550-b com 2 velocidades + função pulsar 550w - preto,6990,9440,1,2045312,loyalt,2026-01-19 16:26:39
2026-01-14 20:56:45,1603361154807-01,Samsung | Smartphone | Celulares e Smartphones,Smartphone Samsung Galaxy A16 128GB 4GB de RAM Verde,82900,94900,1,1867809,webfones,2026-01-19 16:26:39
2026-01-14 20:52:46,1603361154805-01,Pipoqueiras | Eletroportáteis,Pipoqueira Britânia Pop Time 127V,14990,25990,1,806,Philco,2026-01-19 16:26:40
2026-01-14 20:50:36,1603361154804-01,Escova Rotativa Modeladora | Cuidados com o Cabelo | Cosméticos e Perfumaria,Escova Secadora Britânia 4 em 1 BELLA01 1300W Bivolt Bivolt,11990,16990,1,229761,Philco,2026-01-19 16:26:40
2026-01-14 20:42:46,1603361154801-01,"Mixers | Liquidificadores, Batedeiras e Processadores | Eletroportáteis",Mixer Britânia BMX400P 3 em 1  400W Preto 127V,15990,25990,1,18223,Philco,2026-01-19 16:26:40
2026-01-14 20:38:34,1603361154797-01,Ventiladores | Eletroportáteis,Ventilador de Coluna Britânia BVT450 Maxx Force 160W 220V,18990,36990,1,155224,Philco,2026-01-19 16:26:41
2026-01-14 20:35:46,1603361154796-01,"Batedeiras | Liquidificadores, Batedeiras e Processadores | Eletroportáteis",Batedeira Philco Planetária PHP500 Turbo 220V,27990,52990,1,131059,Philco,2026-01-19 16:26:41
2026-01-14 20:26:16,1603351154791-01,Escova Rotativa Modeladora | Cuidados com o Cabelo | Cosméticos e Perfumaria,Escova Secadora Britânia 4 em 1 BELLA01 1300W Bivolt Bivolt,11990,16990,1,229761,Philco,2026-01-19 16:26:41
2026-01-14 20:19:47,1603351154787-01,Máquinas de Lavar Roupas | Máquinas de Lavar e Secadoras | Eletrodomésticos,"Máquina de Lavar Electrolux 8,5kg Branca Turbo Economia com Jet&Clean e Filtro Fiapos (LAC09) 220V",153900,221900,1,1107349,electrolux,2026-01-19 16:26:42
2026-01-14 20:16:19,1603351154784-01,Celulares e Smartphones,"Smartphone motorola moto g06 4g tela 6,9” 128gb câmera 50mp azul marinho",69700,89900,1,2047097,loyalt,2026-01-19 16:26:42
2026-01-14 20:13:24,1603351154783-01,Ventiladores | Eletroportáteis,Ventilador britânia bvt301 para mesa ou parede 60w 3 velocidades 6 pás - preto,12311,14690,1,2463489,loyalt,2026-01-19 16:26:42
2026-01-14 20:12:48,1603351154782-01,Aspiradores de Pó e Água | Eletroportáteis,Aspirador de Pó Vertical com Fio Electrolux 1100W 2 em 1 Filtro HEPA Azul (STK13A) 220V,14990,25990,1,1107439,electrolux,2026-01-19 16:26:42
2026-01-14 20:12:20,1603351154781-01,"Aparelhos de Jantar | Louça, Copos e Talheres | Casa e Cozinha",Aparelho de jantar 20 peças tramontina floralis em porcelana floral,22990,26240,1,2046333,loyalt,2026-01-19 16:26:43
2026-01-14 20:04:14,1603351154777-01,Cuidados com o Cabelo | Cosméticos e Perfumaria,Secador De Cabelo Britânia BSC1200 Bivolt 1200W SECADOR CAB BRITANIA BSC1200 BIVOLT 1200,5990,13990,1,798872,Philco,2026-01-19 16:26:43
2026-01-14 20:03:51,1603351154776-01,Máquinas de Lavar Roupas | Máquinas de Lavar e Secadoras | Eletrodomésticos,Máquina de Lavar 14 Kg Philco PLR14A 12 Programas de Lavagem 220V,154990,239990,1,1047681,Philco,2026-01-19 16:26:43
2026-01-14 20:00:08,1603351154771-01,Fornos de Micro-Ondas | Eletrodomésticos,Micro-ondas Philco PMO42EB Jumbo Tira Odor 42L 1560W 127V,74990,92990,1,117855,Philco,2026-01-19 16:26:44
2026-01-14 19:58:51,1603351154769-01,Ventiladores | Eletroportáteis,Ventilador Britânia 2 em 1 BVT400 Maxx Force 150W 220V,12990,20990,1,155222,Philco,2026-01-19 16:26:44
2026-01-14 19:54:25,1603351154766-01,Ventiladores | Eletroportáteis,Ventilador Britânia BVT301 Tecnologia Maxx Force 60W 220V,10990,19990,1,155335,Philco,2026-01-19 16:26:44
2026-01-14 19:51:32,1603351154765-01,Ventiladores | Eletroportáteis,Ventilador Britânia 2 em 1 BVT400 Maxx Force 150W 127V,12990,20990,3,155222,Philco,2026-01-19 16:26:45
2026-01-14 19:41:25,1603351154761-01,Sanduicheiras e Grelhas Elétricas | Eletroportáteis,Sanduicheira e Grill Britânia BGRE01 2 em 1 750W 127V,9990,11990,1,732521,Philco,2026-01-19 16:26:45
2026-01-14 19:39:56,1603351154760-01,"Formas | Assadeiras, Fôrmas e Travessas | Casa e Cozinha",Conjunto de travessas refratárias marinex em vidro - 10 peças,11990,13900,1,2135902,loyalt,2026-01-19 16:26:45
2026-01-14 19:38:07,1603351154758-01,Computadores de Mesa | Computadores e Informática,Ventilador Mesa Dobravel 3 Velocidades Usb Portatil Iluminaçao Led Verao Calor Sol Dias Quentes Escrivaninha Decoraçao,7765,7765,1,2352417,webcontinentalmktplace,2026-01-19 16:26:45
2026-01-14 19:38:07,1603351154758-02,Varal | Utilidades Domésticas | Casa e Cozinha,Varal de Parede Toalheiro Aço Branco - MAXEB,6999,6999,2,2116307,minipreco,2026-01-19 16:26:46
2026-01-14 19:37:04,1603351154756-01,Panelas de Arroz | Eletroportáteis Especiais | Eletroportáteis,Panela de Arroz BPA10PI XI75 10 Xícaras 127V,16990,31990,1,1000,Philco,2026-01-19 16:26:46
2026-01-14 19:37:04,1603351154756-01,Ventiladores | Eletroportáteis,Ventilador Britânia 2 em 1 BVT400 Maxx Force 150W 127V,12990,20990,1,155222,Philco,2026-01-19 16:26:46
2026-01-14 19:37:04,1603351154756-01,Panelas de Arroz | Eletroportáteis Especiais | Eletroportáteis,Panela de Arroz Philco 5 Xícaras PH5P Visor Glass Inox 127V,13990,24990,1,1040,Philco,2026-01-19 16:26:46
2026-01-14 19:37:04,1603351154756-02,Pele | Cosméticos e Perfumaria,Principia kit - sérum am-10 + sérum ah-2,10161,10161,1,2069531,loyalt,2026-01-19 16:26:46
2026-01-14 19:33:06,1603351154752-01,Panelas de Pressão Elétricas | Eletroportáteis Especiais | Eletroportáteis,Panela de Pressão Digital Philco 6L Inox Preta 220V,49990,57990,1,1346,Philco,2026-01-19 16:26:47
2026-01-14 19:28:20,1603341154748-01,"TVs | Cinema, TV e Áudio",Smart tv 32” philco led hd p32cra roku tv hdr dolby audio wi-fi dual band hdmi usb,84338,101895,1,2046128,loyalt,2026-01-19 16:26:47
2026-01-14 19:28:20,1603341154748-02,Balcão | Cozinha | Móveis,Kit Balcão Cozinha para Cooktop/Forno 105cm e Gabinete Pia 120cm Veneza Multimóveis MP2290 Branco/Dourado,88999,88999,1,1849392,multimoveis,2026-01-19 16:26:47
2026-01-14 19:28:20,1603341154748-03,Ventiladores | Eletroportáteis,Ventilador de Coluna Britânia BVT450 Maxx Force 160W 220V,18990,36990,1,155224,Philco,2026-01-19 16:26:47
2026-01-14 19:27:02,1603341154746-01,Mangueiras | Hidráulico | Materiais de Construção,Mangueira flex transparente 30 metros Tramontina,12260,19616,1,28620,tfdbn2,2026-01-19 16:26:48
2026-01-14 19:27:02,1603341154746-02,Quarto Infantil | Quarto | Móveis,Cômoda 10 Gavetas Premium Marbela Branca,28535,37059,1,1807548,webcontinentalmktplace,2026-01-19 16:26:48
2026-01-14 19:24:29,1603341154745-01,PJ Masks | Personagens | Brinquedos | Meninas | Faz de Conta | Meninos | Faz de Conta,Laptop Infantil Bilíngue - PJ Masks - Candide CAN1733,9999,9999,1,8904,bumerangbrinquedos,2026-01-19 16:26:48
2026-01-14 19:12:13,1603341154740-01,Ventiladores | Eletroportáteis,Ventilador Prime Air 160W Grade de 48cm AVTE450 127V,20990,25990,1,714173,Philco,2026-01-19 16:26:48
2026-01-14 19:12:13,1603341154740-02,Mangueiras | Hidráulico | Materiais de Construção,Mangueira Flex Tramontina Verde PVC Engate Rosqueado e Esguicho 10m,4590,7344,1,28418,tfdbn2,2026-01-19 16:26:49
2026-01-14 19:09:36,1603341154735-01,"Talheres e Porta-Talheres | Louça, Copos e Talheres | Casa e Cozinha",Jogo de Facas Tramontina Plenus com Lâminas em Aço Inox Cabos de Polipropileno Preto e Suporte de Madeira 6 Peças,11445,14900,1,153342,marinbrasil,2026-01-19 16:26:49
2026-01-14 19:08:29,1603341154734-01,Fogões | Fogões e Cooktops | Eletrodomésticos,Fogão 5 Bocas Mônaco Top Glass Mesa Vidro Preto Atlas Bivolt,124990,149990,1,42839,multilojaonline,2026-01-19 16:26:49
2026-01-14 19:04:22,1603341154732-01,Secador de Cabelo | Cuidados com o Cabelo | Cosméticos e Perfumaria,Modelador Triondas De Cachos 32mm Profissional Cerâmico Cachos De Sereia Ondulador Ondas Perfeitas 110V,14900,14900,1,1242039,webcontinentalmktplace,2026-01-19 16:26:50
2026-01-14 18:59:06,1603341154726-01,Colônias | Perfumes | Cosméticos e Perfumaria,Colônia Granado Terrapeutics Lavanda e Cedro 230ML,8999,8999,1,832576,farmaciaindiana,2026-01-19 16:26:50
2026-01-14 18:56:17,1603341154723-01,Cooktops | Fogões e Cooktops | Eletrodomésticos,Fogão Elétrico De Mesa 2 Pratos 2000W FG02 Double Cook Preto Elgin 220V,13143,13143,1,1889857,webcontinentalmktplace,2026-01-19 16:26:50
2026-01-14 18:52:36,1603341154721-01,Fraldas | Bebês e Infantil,Fralda Pampers Confortsec Bag Max XG 88 Unidades FR PAMPERS CONFORTSEC BAG MAX XG 88U,14999,17299,1,725840,farmaciaindiana,2026-01-19 16:26:50
2026-01-14 18:48:43,1603341154714-01,Máquinas de Lavar Roupas | Máquinas de Lavar e Secadoras | Eletrodomésticos,Máquina de Lavar Electrolux 13kg Branca Essential Care com Cesto Inox e Jet&Clean (LED13) 127V,179900,283900,1,1107329,electrolux,2026-01-19 16:26:51
2026-01-14 18:45:08,1603341154712-01,Aspiradores de Pó e Água | Eletroportáteis,Aspirador de Pó Vertical com Fio Electrolux 1450W 2 em 1 Filtro HEPA Branco (STK14B) 220V,16990,30990,1,1108180,electrolux,2026-01-19 16:26:51
2026-01-14 18:44:11,1603341154711-01,Lavadoras de Alta Pressão | Eletrodomésticos,Lavadora de Alta Pressão Electrolux 1650PSI 1400W EasyWash com Engate Rápido (QWS1650) 220V,41990,47990,1,1107952,electrolux,2026-01-19 16:26:51
2026-01-14 18:44:05,1603341154710-01,Aspiradores de Pó e Água | Eletroportáteis,Aspirador de Água e Pó Philco 1500W 20L PAS80 220V,25990,42990,1,857198,Philco,2026-01-19 16:26:51
2026-01-14 18:41:58,1603341154707-01,Hidratante | Higiene | Saúde e Bem Estar,O Boticário Malbec Pure Gold Colônia 100ml,22900,22900,1,2546740,webcontinentalmktplace,2026-01-19 16:26:52
2026-01-14 18:40:27,1603341154700-01,Máquinas de Lavar Roupas | Máquinas de Lavar e Secadoras | Eletrodomésticos,Lavadora de Roupas Mueller Family Lite Semiautomática 10kg Preto 110 V,54990,63990,1,49421,multilojaonline,2026-01-19 16:26:52
2026-01-14 18:40:27,1603341154700-02,Praia e Parque | Esporte e Lazer,Piscina Infantil 1000l Mor Retangular Verão - Casa Dos Fogões,19690,19690,1,1103912,webcontinentalmktplace,2026-01-19 16:26:52
2026-01-14 18:36:26,1603341154698-01,"Sabonetes Líquidos, Óleos e Loções | Corpo e Banho | Cosméticos e Perfumaria",Kit Sabonete Protex Vitamina e Pague 5 Leve 6,1629,2199,1,727840,farmaconde,2026-01-19 16:26:52
2026-01-14 18:36:26,1603341154698-01,Rosto | Pele | Cosméticos e Perfumaria,Esfoliante Rosto e Corpo Labotrat Melancia 150g,1990,1990,1,1187880,farmaconde,2026-01-19 16:26:52
2026-01-14 18:36:26,1603341154698-01,"Sabonetes Líquidos, Óleos e Loções | Corpo e Banho | Cosméticos e Perfumaria",Sabonete Granado Enxofre 90g,980,980,1,727589,farmaconde,2026-01-19 16:26:52
2026-01-14 18:36:26,1603341154698-01,Shampoos e Condicionadores | Higiene | Saúde e Bem Estar,Shampoo TRESemmé Brilho Lamear - 650ml,2999,2999,1,366497,farmaconde,2026-01-19 16:26:52
2026-01-14 18:36:26,1603341154698-01,Cremes | Bem-Estar | Saúde e Bem Estar,ESFOLIANTE LABROTAT 150G MORANGO,1579,1999,1,819780,farmaconde,2026-01-19 16:26:52
2026-01-14 18:36:26,1603341154698-01,Cremes e Máscaras pra cabelo | Cuidados com o Cabelo | Cosméticos e Perfumaria,Creme Milagroso 3 Em 1 L'oréal Paris Elseve Cachos Longos Dos Sonhos - 500ml,2999,3599,1,387810,farmaconde,2026-01-19 16:26:52
2026-01-14 18:36:26,1603341154698-01,Absorventes | Higiene | Saúde e Bem Estar,Absorvente Sym Regular Suave Com Abas Odor Block 30 Unidades Absorvente Sym Regular Suave Com Abas Odor Block Promocional 30 Unidades,1490,1490,1,850370,farmaconde,2026-01-19 16:26:52
2026-01-14 18:36:26,1603341154698-01,Papel Higiênico | Higiene | Saúde e Bem Estar,Papel Higiênico Cotton Folha Dupla Neutro Leve 12 Pague 11 Unidades,1786,2190,1,1289574,farmaconde,2026-01-19 16:26:52
2026-01-14 18:23:54,1603331154690-01,Panelas Elétricas | Eletroportáteis Especiais | Eletroportáteis,Panela de Pressão Elétrica 3L Vermelho/Inox 700W 127V Mondial,34910,34910,1,996106,minipreco,2026-01-19 16:26:53
2026-01-14 18:15:20,1603331154685-01,Lixeiras | Limpeza Doméstica | Casa e Cozinha,Lixeira C/pedal Preto 7 Litros Eco Nature Jaguar,1903,1903,1,1103456,webcontinentalmktplace,2026-01-19 16:26:53
2026-01-14 18:15:20,1603331154685-02,Lixeiras | Limpeza Doméstica | Casa e Cozinha,LIXEIRA TAMPA ECO NATURE PRETA 60L 3079 JAGUAR,5990,5990,1,843356,minipreco,2026-01-19 16:26:53
2026-01-14 18:12:33,1603331154684-01,Panelas Elétricas | Eletroportáteis Especiais | Eletroportáteis,Panela de Arroz Elétrica Gallant 10 Cups 127V (GRC10M03A-127BR),16900,16900,1,2281563,webcontinental,2026-01-19 16:26:53
2026-01-14 18:11:55,1603331154683-01,Carros de passeio | Pneus | Produtos automotivos,Pneu Aro 13 175/70R13 82H Eco Plush Accelera,24762,24762,2,815398,pneubarato,2026-01-19 16:26:54
2026-01-14 18:11:28,1603331154680-01,Fornos de Micro-Ondas | Eletrodomésticos,Micro-ondas Electrolux 20L Branco com Função Tira Odor e Descongelar (MTO30) 220V,54900,73900,1,1107434,electrolux,2026-01-19 16:26:54
2026-01-14 18:11:28,1603331154680-03,Fritadeiras Elétricas | Eletroportáteis,Air Fryer Oven Philco PFR2200 4 em 1 Preta 220V,59990,69990,1,17905,Philco,2026-01-19 16:26:55
2026-01-14 18:11:28,1603331154680-02,Ar-condicionado | Eletrodomésticos,Ventilador de mesa 40cm mondial super turbo vtx-40-8p 8 pás 3 velocidades preto,18500,22040,2,2044915,loyalt,2026-01-19 16:26:55
2026-01-14 18:09:02,1603331154679-01,Samsung | Smartphone | Celulares e Smartphones,Smartphone Samsung Galaxy A16 128GB 4GB de RAM Cinza,82900,94900,1,1867810,webfones,2026-01-19 16:26:55
2026-01-14 18:09:00,1603331154678-01,Motorola | Smartphone | Celulares e Smartphones,Smartphone Motorola Moto G05 256GB 12GB de RAM Vermelho,82900,89900,1,2078329,webfones,2026-01-19 16:26:56
2026-01-14 18:08:59,1603331154677-01,Bem-Estar | Saúde e Bem Estar,"Magnésio Quelato 500mg 60 Capsulas Alta Absorção Para Saúde óssea, Muscular E Mental!",3700,3700,2,1761252,webcontinentalmktplace,2026-01-19 16:26:56
2026-01-14 18:05:43,1603331154674-01,Celulares e Smartphones,Celular samsung galaxy a07 tela 6.7” 256gb 4g 90hz câmera dupla 50mp verde,77900,109900,1,2047276,loyalt,2026-01-19 16:26:56
2026-01-14 18:02:18,1603331154673-01,Escova Rotativa Modeladora | Cuidados com o Cabelo | Cosméticos e Perfumaria,Escova Secadora Britânia 4 em 1 BES35 1300W Bivolt Bivolt,13990,14990,1,748495,Philco,2026-01-19 16:26:56
2026-01-14 18:02:17,1603331154672-01,Ventiladores | Eletroportáteis,Ventilador de Coluna Britânia BVT450 Maxx Force 160W 127V,18990,36990,1,155224,Philco,2026-01-19 16:26:56
2026-01-14 18:02:17,1603331154672-01,Fritadeiras Elétricas | Eletroportáteis,Air Fryer Britânia 5L Antiaderente Gold 1500W BAF45A 127V,25990,42990,1,1367850,Philco,2026-01-19 16:26:56
2026-01-14 18:00:47,1603331154671-01,Samsung | Smartphone | Celulares e Smartphones,Smartphone Samsung Galaxy A16 128GB 4GB de RAM Verde,82900,94900,1,1867809,webfones,2026-01-19 16:26:56
2026-01-14 17:58:26,1603331154668-01,Praia e Parque | Esporte e Lazer,Guarda-Sol Fashion 180 Cm,4290,4290,1,812870,webcontinentalmktplace,2026-01-19 16:26:56
2026-01-14 17:55:22,1603331154666-01,Ferramentas Elétricas | Materiais de Construção,Parafusadeira e furadeira wap wf12k3.2 bateria 12v bivolt,14900,19990,1,2046288,loyalt,2026-01-19 16:26:57
2026-01-14 17:54:38,1603331154665-01,Cozinha Industrial | Eletrodomésticos,Jogo De Assadeiras Opaline Marinex Nadir Kit 3 Unidades,14850,14850,1,2243871,webcontinentalmktplace,2026-01-19 16:26:57
2026-01-14 17:53:50,1603331154664-01,Sanduicheiras e Grelhas Elétricas | Eletroportáteis,Sanduicheira e Grill Britânia BGR27I Press 2 em 1 850W 127V,10990,20990,1,7570,Philco,2026-01-19 16:26:57
2026-01-14 17:46:04,1603331154660-01,Ventilador de parede | Eletrodomésticos,Ventilador de Parede Britânia BVT575 Maxx Force 6 Pás 176W 220V,20990,26990,1,671020,Philco,2026-01-19 16:26:57
2026-01-14 17:45:03,1603331154659-01,Balcão | Cozinha | Móveis,Balcão Multiuso 2 Portas Denver Aramóveis Branco S/V,15990,18990,1,454149,multilojaonline,2026-01-19 16:26:57
2026-01-14 17:38:10,1603331154658-01,Escova Secadora | Cuidados com o Cabelo | Cosméticos e Perfumaria,Escova Secadora GA.MA Avocado Power Brush 3D - Bivolt,19990,49990,1,1665002,gamaitaly,2026-01-19 16:26:57
2026-01-14 17:34:55,1603331154657-01,"Liquidificadores | Liquidificadores, Batedeiras e Processadores | Eletroportáteis",Liquidificador Electrolux 1300W 3.2L Efficient TriForce 12 Velocidades Branco (EBL1310) 127V,24990,24990,1,1868266,electrolux,2026-01-19 16:26:57
2026-01-14 17:30:27,1603331154655-01,Smartwatches | Eletrônicos,Smartwatch Positivo Watch Essential IP68 até 10 dias de Bateria Tela IPS Monitoramento 1.83” - Preto,21900,49900,1,856218,lojapositivo,2026-01-19 16:26:58
2026-01-14 17:27:35,1603321154653-01,Ferramentas Elétricas | Materiais de Construção,Parafusadeira e furadeira wap wf12k3.2 bateria 12v bivolt,14900,19990,1,2046288,loyalt,2026-01-19 16:26:58
2026-01-14 17:09:28,1603321154650-01,Fritadeiras Elétricas | Eletroportáteis,"Fritadeira Elétrica Sem Óleo Mondial New Pratic AF-31 3,5L 1500W Preta 127V 76426-01",19990,32990,1,826019,minipreco,2026-01-19 16:26:58
2026-01-14 17:02:49,1603321154649-01,Panelas de Arroz | Eletroportáteis Especiais | Eletroportáteis,Panela de Arroz BPA10PI XI75 10 Xícaras 127V,16990,31990,1,1000,Philco,2026-01-19 16:26:58
2026-01-14 17:00:01,1603321154648-01,Roupa de Cama | Cama e Banho | Casa e Cozinha,Jogo de Cama Poá Casal Lar E Lazer Azul UN,5999,7999,1,1424474,rovitex,2026-01-19 16:26:58
2026-01-14 16:49:12,1603321154646-01,"Pratos | Louça, Copos e Talheres | Casa e Cozinha",Aparelho de Jantar Porcelana Preto 20 peças D1-60667 Real Price,19990,39990,2,797240,minipreco,2026-01-19 16:26:58
2026-01-14 16:48:14,1603321154645-01,Mesas De Jantar | Sala de Jantar | Móveis,Mesa De Jantar Thais 70x70 Cm Com Granito Ocre Itabira Com 4 Cadeiras 063 Preto - Artefamol,57835,57835,1,2228826,webcontinentalmktplace,2026-01-19 16:26:58
2026-01-14 16:46:07,1603321154643-01,Balcão | Cozinha | Móveis,Balcão de Cozinha com Tampo 3 Portas 90cm Isadora Poquema Branco S/V,27590,34990,1,1623392,multilojaonline,2026-01-19 16:26:58
2026-01-14 16:42:08,1603321154642-01,Informática | Livros,"Notebook lenovo intel core i5 16gb ram 512gb ssd tela 15,6"" 144hz rtx3050 windows 11 - loq-e 83me0007br",459900,548217,1,2299582,loyalt,2026-01-19 16:26:58
2026-01-14 16:30:20,1603321154641-01,Perfumes | Cosméticos e Perfumaria,J'adore dior - perfume feminino - eau de parfum,92225,108500,1,2109168,loyalt,2026-01-19 16:26:59
2026-01-14 16:11:14,1603311154638-03,"Talheres e Porta-Talheres | Louça, Copos e Talheres | Casa e Cozinha",Faqueiro Tramontina Carmel 24 Peças Turquesa Médio,14981,14981,1,1964644,webcontinentalmktplace,2026-01-19 16:26:59
2026-01-14 16:11:14,1603311154638-01,Sanduicheiras e Grelhas Elétricas | Eletroportáteis,Sanduicheira e Grill Philco PGR11P Antiaderente 750W 127V,9990,12990,1,131153,Philco,2026-01-19 16:26:59
2026-01-14 16:11:14,1603311154638-02,Panelas de Arroz | Eletroportáteis Especiais | Eletroportáteis,"Panela de Arroz Elétrica Electrolux por Rita Lobo 1,3L Branca Efficient (RCB50) 127V",16990,30990,1,1107836,electrolux,2026-01-19 16:26:59
2026-01-14 16:10:30,1603311154637-01,Amamentação e Alimentação | Bebês e Infantil,"Ninho 1+ Fases Lata 1,2kg",7199,7199,2,1199696,farmaconde,2026-01-19 16:26:59
2026-01-14 16:09:15,1603311154636-01,Ventiladores | Eletroportáteis,Ventilador Mesa Portátil Usb Torre Circulador Vertical 2 Cor:branco,7151,7151,1,2037837,webcontinentalmktplace,2026-01-19 16:26:59
2026-01-14 16:09:15,1603311154636-01,Malas | Bolsas e Mochilas,Kit Mala De Viagem ABS 2 Peças Adventure E Action Fortt Azul MAB01-AZ,29890,29890,1,1720274,webcontinentalmktplace,2026-01-19 16:26:59
2026-01-14 15:54:33,1603311154633-01,Panelas e Utensílios para Cozinhar | Casa e Cozinha,POTE REDONDO SORTIDO 250ML 1145T MB,269,269,1,1635565,minipreco,2026-01-19 16:26:59
2026-01-14 15:53:41,1603311154631-01,Banho do Bebê | Bebês e Infantil,"Shampoo Para Bebê Johnson's Baby De Glicerina, 200ml",1359,1999,1,725294,farmaciaindiana,2026-01-19 16:26:59
2026-01-14 14:57:11,1603301154627-01,Fones de Ouvido | Celulares e Smartphones,Fone de Ouvido Apple EarPods com Conector USB-C Branco,23000,30000,1,1895802,shophub,2026-01-19 16:26:59
2026-01-14 14:57:01,1603301154626-01,Panelas de Arroz | Eletroportáteis Especiais | Eletroportáteis,Panela de Arroz Philco 5 Xícaras PH5P Visor Glass Inox 127V,13990,24990,1,1040,Philco,2026-01-19 16:27:00
2026-01-14 14:52:30,1603301154624-01,Guarda-Sol | Praia e Parque | Esporte e Lazer,Base Para Ombrelone E Guarda Sol Ajustável 36mm Preta,7782,7782,1,1424313,webcontinentalmktplace,2026-01-19 16:27:00
2026-01-14 14:52:30,1603301154624-02,Climatizador | Eletroportáteis,Climatizador Britânia 4 em 1 Autonomia de 26h BCL05A 220V,36990,52990,1,1268197,Philco,2026-01-19 16:27:00
2026-01-14 14:34:44,1603301154623-01,Piscinas e Acessórios | Jardim e Exteriores | Casa e Cozinha,Piscina Inflável 1400 Litros Redonda Splash Fun Mor,18896,18896,1,1654469,webcontinentalmktplace,2026-01-19 16:27:00
2026-01-14 14:00:36,1603291154619-01,"TVs | Cinema, TV e Áudio",Smart tv 43” tcl 43s5k qled full hd google tv wi-fi,137600,188895,1,2299578,loyalt,2026-01-19 16:27:00
2026-01-14 13:59:22,1603291154618-01,Xiaomi | Smartphone | Celulares e Smartphones,Smartphone Realme Note 60S 128GB 4GB de RAM Verde,74900,74900,1,1804046,webfones,2026-01-19 16:27:00
2026-01-14 13:57:07,1603291154613-02,Pipoqueiras | Eletroportáteis,Pipoqueira Britânia Poplite BPI01 Vermelho 110 V,12990,25990,1,758,Philco,2026-01-19 16:27:00
2026-01-14 13:57:07,1603291154613-01,Bonecos | Meninos | Brinquedos,Boneco Articulado 30cm Super Homem DC Sunny,12999,12999,1,40157,bumerangbrinquedos,2026-01-19 16:27:00
