creationDate,orderId,categoryName,name,price,listPrice,quantity,productId,seller,data_extracao
2026-01-07 09:51:04,1601571151302-01,Cooktops | Fogões e Cooktops | Eletrodomésticos,Fogão Elétrico Portátil Cooktop 1 Boca 1000W Extream 127V,5790,9900,1,2137566,tetrix,2026-01-08 11:57:40
2026-01-07 09:37:22,1601571151301-01,"Mixers | Liquidificadores, Batedeiras e Processadores | Eletroportáteis",Mixer Britânia BMX370RS Rosa 350W 220V,10990,12990,1,295166,Philco,2026-01-08 11:57:41
2026-01-07 09:35:32,1601571151300-01,Cômoda | Quarto | Móveis,Cômoda 4 Gavetas 2 Portas com Pés Pinhais 2.4 Santos Andirá Jatoba/Areia S/V,52590,63990,1,2447969,multilojaonline,2026-01-08 11:57:41
2026-01-07 09:35:32,1601571151300-01,Mesa de cabeceira | Quarto | Móveis,Mesa de Cabeceira 4 Gavetas Presence Demobile Amendola Touch  S/V,21990,24990,1,779838,multilojaonline,2026-01-08 11:57:41
2026-01-07 09:28:39,1601561151298-01,Aspiradores de Pó e Água | Eletroportáteis,Aspirador de Pó Vertical 2 em 1 1400W Philco PAS1550C 220V,16990,20990,1,136058,Philco,2026-01-08 11:57:41
2026-01-07 09:28:05,1601561151297-01,Sabonetes | Higiene | Saúde e Bem Estar,Sabonete Siene Perfumado Rosas Vermelhas 85g,149,159,6,833317,farmaciaindiana,2026-01-08 11:57:42
2026-01-07 09:28:05,1601561151297-01,Limpeza Doméstica | Casa e Cozinha,DETERGENTE YPE 500ML NEUTRO,279,299,2,715213,farmaciaindiana,2026-01-08 11:57:42
2026-01-07 09:28:05,1601561151297-01,Cremes Dentais | Higiene Bucal | Higiene | Saúde e Bem Estar,Creme Dental Colgate Tripla Ação Menta Original 90g,589,759,2,726186,farmaciaindiana,2026-01-08 11:57:42
2026-01-07 09:28:05,1601561151297-01,Papel Higiênico | Higiene | Saúde e Bem Estar,Papel Higiênico Deluxe Cotton Folha dupla 20 Metros 12 Unidades,1299,1579,1,2333119,farmaciaindiana,2026-01-08 11:57:42
2026-01-07 09:28:05,1601561151297-01,Desodorante | Higiene | Saúde e Bem Estar,Desodorante Axe Aerossol 150ml Dark Temptation DES AXE AERO 150ML DARK TEMPTATION,1039,1190,1,726183,farmaciaindiana,2026-01-08 11:57:42
2026-01-07 09:26:05,1601561151295-01,Panelas e Utensílios para Cozinhar | Casa e Cozinha,Processador New Oggi 127V - MALLORY,9990,9990,1,941489,minipreco,2026-01-08 11:57:42
2026-01-07 09:20:29,1601561151293-01,Celulares e Smartphones,"Smartphone motorola edge 60 fusion 5g rosa 256gb, 8gb ram, tela 6,7"", câmera sony lytia 700c 50mp, gorilla glass 7i, dimensity 7300, ip69 e ip68",185200,233200,1,2137843,loyalt,2026-01-08 11:57:42
2026-01-07 09:17:55,1601561151292-01,"Liquidificadores | Liquidificadores, Batedeiras e Processadores | Eletroportáteis",Liquidificador Philco PH900 Preto 1200W 127V,15990,19990,1,1303,Philco,2026-01-08 11:57:43
2026-01-07 09:13:24,1601561151291-01,Amamentação e Alimentação | Bebês e Infantil,Nan Comfor 1 Lata 800g,6999,6999,1,1204157,farmaconde,2026-01-08 11:57:43
2026-01-07 09:13:24,1601561151291-01,Banho do Bebê | Bebês e Infantil,Talco Infantil Johnsons Baby Hora do Sono Frasco 100g,2499,2799,1,904040,farmaconde,2026-01-08 11:57:43
2026-01-07 09:13:24,1601561151291-01,Cuidados com a Saúde | Bebês e Infantil,Creme Preventivo de Assaduras Pomada Transparente - Hipoglós - 30g,2899,2899,1,142832,farmaconde,2026-01-08 11:57:43
2026-01-07 09:13:24,1601561151291-01,"Sabonetes Líquidos, Óleos e Loções | Corpo e Banho | Cosméticos e Perfumaria",Sabonete Líquido Hora do Sono Refil - Johnson's Baby - 180ml,1699,1699,1,143425,farmaconde,2026-01-08 11:57:43
2026-01-07 09:00:11,1601561151290-01,Esporte e Lazer | Meninos | Brinquedos,PISCINA INFLAVEL 1000L 1048 MOR,19990,19990,1,795512,minipreco,2026-01-08 11:57:43
2026-01-07 08:51:48,1601561151288-01,Xiaomi | Smartphone | Celulares e Smartphones,Smartphone Realme Note 60S 128GB 4GB de RAM Verde,74900,74900,1,1804046,webfones,2026-01-08 11:57:44
2026-01-07 08:46:27,1601561151285-01,Mamadeira e Acessórios | Bebês e Infantil,Kit Mamadeiras Lillo Evolution Primeiros Passos Azul 50ml+120ml+260ml Kit Mamadeiras Primeiros Passos Azul 50ml+120ml+260ml,7399,7399,1,830952,farmaciaindiana,2026-01-08 11:57:44
2026-01-07 08:45:26,1601561151284-01,Bolsas e Mochilas,Mochila Para Notebook Executiva Spartan Isiway Psm1600100 Preto U,5190,5190,1,1137830,webcontinentalmktplace,2026-01-08 11:57:44
2026-01-07 08:42:05,1601561151281-01,Cooktops | Fogões e Cooktops | Eletrodomésticos,Cooktop Atlas U Top 5 Bocas Acendimento Automático Preto Bivolt,47990,63990,1,136388,multilojaonline,2026-01-08 11:57:45
2026-01-07 08:29:54,1601551151280-01,Ventiladores | Eletroportáteis,Ventilador Prime Air AVTE400 Tecnologia Maxx Force 150W 127V,14990,17990,1,714190,Philco,2026-01-08 11:57:45
2026-01-07 08:00:42,1601551151276-01,Aspiradores de Pó e Água | Eletroportáteis,Aspirador de Pó e Água Electrolux 1400W 5L c/ Conjunto de Acessórios e Rodas 360° (AWD01) 127V,24990,35990,1,1107494,electrolux,2026-01-08 11:57:45
2026-01-07 08:00:42,1601551151276-02,"Liquidificadores | Liquidificadores, Batedeiras e Processadores | Eletroportáteis",Liquidificador Britânia Diamante Preto 900W 127V,18990,21990,1,1911,Philco,2026-01-08 11:57:45
2026-01-07 07:30:52,1601551151274-01,Sistemas de som | Produtos automotivos,Auto Radio Jbl Celebrity 150 Mp3/bt/usb/sd,41982,41982,1,1670691,webcontinentalmktplace,2026-01-08 11:57:46
2026-01-07 06:06:58,1601531151268-01,Chapinhas e Pranchas | Cuidados com o Cabelo | Cosméticos e Perfumaria,Chapinha | prancha taiff red ion 200°c preto/vermelho - bivolt,16900,23990,1,2299558,loyalt,2026-01-08 11:57:46
2026-01-07 05:42:10,1601531151266-01,Ventiladores | Eletroportáteis,Ventilador Britânia BVT301 Tecnologia Maxx Force 60W 127V,18990,19990,2,155335,Philco,2026-01-08 11:57:47
2026-01-07 04:51:10,1601521151261-01,Guarda-Roupa E Roupeiros | Quarto | Móveis,Guarda Roupa Casal Ripado 6 Portas Fortaleza Faimec Freijo/Off White S/V,95990,112990,1,1291191,multilojaonline,2026-01-08 11:57:47
2026-01-07 04:51:10,1601521151261-01,Guarda-Roupa E Roupeiros | Quarto | Móveis,Guarda-Roupa Solteiro 3 Portas 2 Gavetas com Pés Coimbra Aramóveis  Atacama/Off White S/V,35990,44990,1,251251,multilojaonline,2026-01-08 11:57:47
2026-01-07 04:42:37,1601521151260-01,Cuidados com o Cabelo | Cosméticos e Perfumaria,Kit Crescimento e Reconstrução Cavalo Forte Haskell 300ml,6303,8404,1,1309136,rothacosmeticos,2026-01-08 11:57:47
2026-01-07 04:37:13,1601521151258-01,Panelas Elétricas | Eletroportáteis Especiais | Eletroportáteis,"Panela De Arroz Elétrica 8 Xícaras 1,5L 500W Inox 110V",17400,17400,1,2424750,webcontinentalmktplace,2026-01-08 11:57:48
2026-01-07 04:37:13,1601521151258-02,Panelas e Utensílios para Cozinhar | Casa e Cozinha,Processador New Oggi 127V - MALLORY,9990,9990,1,941489,minipreco,2026-01-08 11:57:48
2026-01-07 04:11:04,1601511151257-01,Ventiladores | Eletroportáteis,Ventilador britânia bvt301 para mesa ou parede 60w 3 velocidades 6 pás - preto,12300,14690,1,2463489,loyalt,2026-01-08 11:57:48
2026-01-07 04:03:05,1601511151256-01,Máquinas de Lavar Roupas | Máquinas de Lavar e Secadoras | Eletrodomésticos,Tanquinho de roupas semiautomática colormaq lcs15 branco com 8 programas de lavagem - 15kg,54000,67100,1,2044994,loyalt,2026-01-08 11:57:48
2026-01-07 03:19:07,1601501151255-01,"Café, Chá e Expresso | Eletroportáteis","Chaleira Elétrica MP Casa 127V 1,8 Litros",4990,8999,1,996214,minipreco,2026-01-08 11:57:49
2026-01-07 02:14:07,1601491151251-01,Motorola | Smartphone | Celulares e Smartphones,Smartphone Motorola Moto G15 256GB 12GB de RAM Grafite,82900,109900,1,1330562,webfones,2026-01-08 11:57:49
2026-01-07 01:37:12,1601491151248-01,Portas e Batentes | Construção | Materiais de Construção,"Porta Sanfonada Pvc 210x60cm Cinza - 400186-500699 - Fortlev Porta Sanfonada Pvc 2,10 X 60 Cinza Fort",11489,11489,1,2030209,webcontinentalmktplace,2026-01-08 11:57:50
2026-01-07 01:22:04,1601481151246-01,Protetores Solares e Bronzeadores | Pele | Cosméticos e Perfumaria,Protetor Helioderm Facial Fps70 50g Kley PROT HELIODERM FACIAL FPS70 50G S/COR,2969,4290,2,718068,farmaciaindiana,2026-01-08 11:57:50
