creationDate,orderId,categoryName,name,price,listPrice,quantity,productId,seller,data_extracao
2025-12-29 02:28:24,1586931147241-01,Fraldas | Bebês e Infantil,Fralda Descartável Flock Baby Sempre Sequinha Mega XXG 28 Unidades,3290,3490,1,1999509,farmaciaindiana,2025-12-31 13:30:02
2025-12-29 02:28:24,1586931147241-01,Absorventes | Higiene | Saúde e Bem Estar,Absorvente Sym Regular Suave Com Abas Odor Block 30 Unidades Absorvente Sym Regular Suave Com Abas Odor Block Promocional 30 Unidades,1090,1399,1,850370,farmaciaindiana,2025-12-31 13:30:02
2025-12-29 02:07:01,1586931147238-01,Cremes e Máscaras pra cabelo | Cuidados com o Cabelo | Cosméticos e Perfumaria,Wella Enrich Invigo - Mascara Capilar 150ml,21900,21900,1,1102660,webcontinentalmktplace,2025-12-31 13:30:03
2025-12-29 01:52:52,1586931147233-01,Escova Rotativa Modeladora | Cuidados com o Cabelo | Cosméticos e Perfumaria,Escova Secadora Britânia 4 em 1 BELLA01 1300W Bivolt Bivolt,11990,16990,1,229761,Philco,2025-12-31 13:30:03
2025-12-29 00:59:45,1586921147231-01,Ar-condicionado | Eletrodomésticos,Ar-Condicionado Janela 10000BTUs Philco Ciclo Frio PAJ10FH 127V,199990,249990,1,2464268,Philco,2025-12-31 13:30:03
2025-12-29 00:47:30,1586921147230-01,Ventiladores | Eletroportáteis,Ventilador Britânia BVT301 Tecnologia Maxx Force 60W 127V,9490,19990,1,155335,Philco,2025-12-31 13:30:03
2025-12-29 00:34:29,1586921147228-01,Ginecológicos | Saúde Da Mulher | Medicamentos,Clotrimazol 20mg/g Medley Genérico Creme Vaginal 20g + 3 Aplicadores,2549,6526,1,1202881,farmaconde,2025-12-31 13:30:04
2025-12-29 00:14:52,1586911147224-01,Smartwatches | Eletrônicos,Smartwatch Positivo Watch Essential IP68 até 10 dias de Bateria Tela IPS Monitoramento 1.83” - Preto,16900,49900,1,856218,lojapositivo,2025-12-31 13:30:04
2025-12-29 00:12:34,1586911147223-01,Celulares e Smartphones,Celular samsung galaxy a07 tela 6.7” 256gb 4g 90hz câmera dupla 50mp verde,84900,98111,1,2047276,loyalt,2025-12-31 13:30:04
2025-12-29 00:12:15,1586911147222-01,Smartphone | Celulares e Smartphones,"Smartphone Infinix Note 50X IA 5G 256GB 8GB RAM 6.67"" Câmera 50MP NFC Bateria 5200mAh Resistência Padrão Militar + IP64 Smartphone Infinix Note 50X IA 5G 256GB 8GB RAM 6,78"" Câmera 50MP NFC Bateria 5200mAh Resistência Padrão Militar + IP64",149900,239900,1,2310172,lojapositivo,2025-12-31 13:30:04
2025-12-28 23:55:11,1586911147219-01,Ventiladores | Eletroportáteis,Ventilador Britânia BVT301 Tecnologia Maxx Force 60W 127V,9490,19990,2,155335,Philco,2025-12-31 13:30:05
2025-12-28 23:54:36,1586911147218-01,Ar-condicionado | Eletrodomésticos,Ar Condicionado Philco Inverter PAC12FB 12000 BTUS Ar Frio Branco 220 V,239990,279990,1,1239859,multilojaonline,2025-12-31 13:30:05
2025-12-28 23:51:46,1586911147217-01,"Multiprocessador | Liquidificadores, Batedeiras e Processadores | Eletroportáteis",Multiprocessador Philco PMP1600P 1400W 127V,34990,42990,1,944,Philco,2025-12-31 13:30:05
2025-12-28 23:47:53,1586911147216-01,Travesseiros | Cama e Banho | Casa e Cozinha,TRAVESSEIRO BLEND 200 FIOS 50X70CM 1317000110002 BELLA ENXOVAIS,2990,4990,4,1739224,minipreco,2025-12-31 13:30:05
2025-12-28 23:44:11,1586911147215-01,Roupa de Cama | Cama e Banho | Casa e Cozinha,Kit Cobre Leito Casal Padrão + Jogo De Lençol Micropercal 300 Fios Com Bordado Inglês Santorini 7 Peças - Bege,46830,46830,1,1642732,webcontinentalmktplace,2025-12-31 13:30:06
2025-12-28 23:18:23,1586901147206-01,Eletroportáteis,Cafeteira Elétrica Cadence Urban Pop Inox 220V,15990,21990,1,1700303,webcontinentalmktplace,2025-12-31 13:30:06
2025-12-28 23:15:59,1586901147205-01,Ventiladores | Eletroportáteis,Ventilador Britânia BVT301 Tecnologia Maxx Force 60W 127V,9490,19990,3,155335,Philco,2025-12-31 13:30:06
2025-12-28 23:11:22,1586901147201-01,"Caixas de Som Portáteis | Áudio | Cinema, TV e Áudio",Caixa de Som Amplificada Philco Flash Light 2600W PCX26000 Bivolt,159990,276990,1,1999706,Philco,2025-12-31 13:30:06
2025-12-28 23:03:50,1586901147198-01,Smartphone | Celulares e Smartphones,Relogio Smartwatch Camera Celular Chip Cartao Musica Rosa,14990,14990,1,1384006,webcontinentalmktplace,2025-12-31 13:30:07
2025-12-28 22:53:09,1586901147183-01,Fogões | Fogões e Cooktops | Eletrodomésticos,Fogão 4Q Atlas Mônaco Plus Acendimento Branco Mesa Inox Bivolt,62990,77990,1,42842,multilojaonline,2025-12-31 13:30:07
2025-12-28 22:50:57,1586901147182-01,Ar-condicionado | Eletrodomésticos,Ventilador de mesa 40cm mondial super turbo vtx-40-8p 8 pás 3 velocidades preto,18991,22040,1,2044915,loyalt,2025-12-31 13:30:07
2025-12-28 22:48:26,1586901147181-01,Chaves | Ferramentas Manuais | Materiais de Construção,Kit De Ferramentas 46 Peças Soquetes De Aço Chaves Catraca Reversível Multiuso Maleta Resistente,4990,4990,1,1808758,webcontinentalmktplace,2025-12-31 13:30:07
2025-12-28 22:35:07,1586901147179-01,Máquinas de Lavar Roupas | Máquinas de Lavar e Secadoras | Eletrodomésticos,Máquina de lavar 13kg electrolux lda13 efficient duplo dispenser máxima diluição cesto inox branca,189900,243042,1,2046803,loyalt,2025-12-31 13:30:08
2025-12-28 22:29:37,1586891147175-01,Piscinas e Acessórios | Jardim e Exteriores | Casa e Cozinha,Piscina Estrutural Armação 6125 Litros + Bomba Filtro Avenli Jilong 220v,120999,120999,1,1802425,webcontinentalmktplace,2025-12-31 13:30:08
2025-12-28 22:29:16,1586891147173-01,Ventiladores | Eletroportáteis,Ventilador Britânia BVT301 Tecnologia Maxx Force 60W 127V,9490,19990,1,155335,Philco,2025-12-31 13:30:08
2025-12-28 22:22:01,1586891147172-01,Eletroportáteis,Omeleteira Mr. Cheff Inox Redonda 800W 127V Agratto,10990,20100,1,861682,funstock,2025-12-31 13:30:08
2025-12-28 22:07:54,1586891147171-01,Ar-condicionado | Eletrodomésticos,Ar Condicionado Philco Inverter PAC12FB 12000 BTUS Ar Frio Branco 220 V,239990,279990,1,1239859,multilojaonline,2025-12-31 13:30:09
2025-12-28 22:07:32,1586891147169-02,Panelas e Utensílios para Cozinhar | Casa e Cozinha,Conjunto Bowls de Inox Electrolux com Tampa Plástica 3 Peças,9490,15900,1,1107949,electrolux,2025-12-31 13:30:09
2025-12-28 22:07:32,1586891147169-02,Panelas de Pressão Elétricas | Eletroportáteis Especiais | Eletroportáteis,Panela de Pressão Elétrica Electrolux por Rita Lobo 3L Preta Efficient c/ Timer (PCE15) 127V,35990,54990,1,1108189,electrolux,2025-12-31 13:30:09
2025-12-28 22:07:32,1586891147169-01,Roupa de Cama | Cama e Banho | Casa e Cozinha,Jogo de Cama Chevron Queen Lar E Lazer Preto UN,6999,11499,1,1631709,rovitex,2025-12-31 13:30:09
2025-12-28 22:07:32,1586891147169-01,Roupa de Cama | Cama e Banho | Casa e Cozinha,Jogo de Cama Poá Casal Lar E Lazer Azul UN,5999,7999,1,1424474,rovitex,2025-12-31 13:30:09
2025-12-28 22:00:29,1586891147168-01,Ventiladores | Eletroportáteis,Ventilador Britânia BVT301 Tecnologia Maxx Force 60W 127V,9490,19990,1,155335,Philco,2025-12-31 13:30:10
2025-12-28 21:57:38,1586891147167-01,Ventiladores | Eletroportáteis,Ventilador Britânia BVT301 Tecnologia Maxx Force 60W 127V,9490,19990,1,155335,Philco,2025-12-31 13:30:10
2025-12-28 21:37:21,1586891147164-01,Colchões | Quarto | Móveis,Colchão Solteiro 88cm Espuma D33 Poliester Pro Firm Umaflex Colchão Solteiro 88cm D33 Poliester Pro Firm Umaflex Preto/Branco S/V,41590,42990,1,313600,multilojaonline,2025-12-31 13:30:10
2025-12-28 21:37:00,1586891147163-01,Guarda-Roupa E Roupeiros | Quarto | Móveis,Guarda-Roupa Casal Madesa Mônaco 3 Portas de Correr com Espelho Cor:Preto,87999,143990,1,3661,madesacms,2025-12-31 13:30:10
2025-12-28 21:37:00,1586891147163-01,Salas De Jantar com 4 cadeiras | Sala de Jantar | Móveis,Conjunto Sala de Jantar Madesa Talita Mesa Tampo de Madeira com 4 Cadeiras Cor:Rustic/Preto/Sintético Preto,47999,86990,1,3502,madesacms,2025-12-31 13:30:10
2025-12-28 21:14:23,1586881147157-01,Ventiladores | Eletroportáteis,Ventilador Britânia 2 em 1 BVT400 Maxx Force 150W 220V,13490,20990,1,155222,Philco,2025-12-31 13:30:11
2025-12-28 21:07:48,1586881147154-01,Colônias | Perfumes | Cosméticos e Perfumaria,Perfume Importado Cacharel Amor Amor 30ml Perfume Cacharel Amor Amor 30ml,17590,18990,1,833768,farmaciaindiana,2025-12-31 13:30:11
2025-12-28 21:07:48,1586881147154-01,Secador de Cabelo | Cuidados com o Cabelo | Cosméticos e Perfumaria,Secador de Cabelos Taiff Style 2000W Profissional Preto 220v,23900,23900,1,54607,farmaciaindiana,2025-12-31 13:30:11
2025-12-28 21:07:48,1586881147154-02,Perfumes | Cosméticos e Perfumaria,Al Wataniah Durrat Al Aroos Eau De Parfum - Perfume Feminino 85ml,29900,29900,1,1250427,webcontinentalmktplace,2025-12-31 13:30:11
2025-12-28 20:54:53,1586881147149-01,Salas De Jantar com 6 cadeiras | Sala de Jantar | Móveis,Conjunto Sala de Jantar Madesa Medelin Mesa Tampo de Madeira com 6 Cadeiras Cor:Rustic/Crema/Sintético Bege,69999,129990,1,8557,madesacms,2025-12-31 13:30:11
2025-12-28 20:46:14,1586881147146-01,Ventiladores | Eletroportáteis,Ventilador de Coluna Britânia BVT450 Maxx Force 160W 127V,18990,36990,2,155224,Philco,2025-12-31 13:30:12
2025-12-28 20:40:28,1586881147144-01,Eletrodomésticos,Geladeira Refrigerador HQ Defrost 230 Litros Branco HQ-230RDF 127V,185444,185444,1,1545254,webcontinentalmktplace,2025-12-31 13:30:13
2025-12-28 20:39:51,1586881147143-01,Circulador de ar | Eletroportáteis,"Climatizador De Ar Cadence Ventilar Duo Tank 5,7L 220V",35990,43490,1,1777998,webcontinentalmktplace,2025-12-31 13:30:13
2025-12-28 20:32:57,1586881147142-01,Protetores Solares e Bronzeadores | Pele | Cosméticos e Perfumaria,Protetor Solar Facial alta proteção ISDIN Extrem90 FPS90-50ml,13767,14490,1,833050,farmaciaindiana,2025-12-31 13:30:13
2025-12-28 20:28:14,1586871147141-01,Ventiladores | Eletroportáteis,Ventilador Britânia BVT301 Tecnologia Maxx Force 60W 127V,9490,19990,2,155335,Philco,2025-12-31 13:30:13
2025-12-28 20:24:54,1586871147140-01,Celulares e Smartphones,Smartphone motorola moto g56 5g tela 6.7” 256gb 8gb ram+16gb ram boost 50mp sony lytia 600 moto ai turbopower 33w ip69 desbloqueado cinza,121900,199900,1,2295626,loyalt,2025-12-31 13:30:14
2025-12-28 20:24:51,1586871147139-01,Ventiladores | Eletroportáteis,Ventilador Britânia BVT301 Tecnologia Maxx Force 60W 127V,9490,19990,2,155335,Philco,2025-12-31 13:30:14
2025-12-28 20:23:47,1586871147138-01,Pele | Cosméticos e Perfumaria,Principia kit - sérum am-10 + sérum ah-2,10161,10161,1,2069531,loyalt,2025-12-31 13:30:14
2025-12-28 20:23:17,1586871147137-01,Secador de Cabelo | Cuidados com o Cabelo | Cosméticos e Perfumaria,Secador de Cabelos Philco Bivolt 2200W PSC2450 Íons Tourmaline Bivolt,20990,21990,1,1264491,Philco,2025-12-31 13:30:14
2025-12-28 20:22:47,1586871147136-01,Ferro de Passar e Passadeiras | Eletroportáteis,Ferro De Passar Oster 2 Em 1 Sem Fio 110V,28990,31990,1,1786409,webcontinentalmktplace,2025-12-31 13:30:15
2025-12-28 20:22:18,1586871147135-01,Ventiladores | Eletroportáteis,Ventilador Britânia BVT301 Tecnologia Maxx Force 60W 127V,9490,19990,1,155335,Philco,2025-12-31 13:30:15
2025-12-28 20:03:15,1586871147125-01,Circulador de ar | Eletroportáteis,"Climatizador De Ar Cadence Compactar 8,4L 110V",37990,43990,1,1777999,webcontinentalmktplace,2025-12-31 13:30:15
2025-12-28 19:57:51,1586871147124-01,Umidificador | Eletroportáteis,Umidificador de Ar Ultrassônico Fisher-Price - HC055 HC055,9989,14990,1,19921,compreja,2025-12-31 13:30:15
2025-12-28 19:55:57,1586871147122-01,Ventiladores | Eletroportáteis,Ventilador Britânia 2 em 1 BVT400 Maxx Force 150W 127V,13490,20990,1,155222,Philco,2025-12-31 13:30:16
2025-12-28 19:55:57,1586871147122-02,Sanduicheiras e Grelhas Elétricas | Eletroportáteis,Sanduicheira e Grill Philco Inox 2 em 1 PGR27A 750W 127V,9990,11990,1,1569989,webcontinentalmktplace,2025-12-31 13:30:16
2025-12-28 19:41:26,1586871147115-01,Parafusadeiras | Ferramentas Elétricas | Materiais de Construção,Parafusadeira Philco Force PPF120MF 3 em 1 1500RPM Bivolt,24990,42990,1,672619,Philco,2025-12-31 13:30:16
2025-12-28 19:38:59,1586871147106-01,"Liquidificadores | Liquidificadores, Batedeiras e Processadores | Eletroportáteis",Liquidificador Britânia Diamante Preto 900W 127V,9990,21990,1,1911,Philco,2025-12-31 13:30:17
2025-12-28 19:31:11,1586871147105-01,Ar-condicionado | Eletrodomésticos,Ventilador de mesa mondial maxis v30mxw 30cm 6 pás 3 velocidades 50w branco / azul,9490,11990,1,2044905,loyalt,2025-12-31 13:30:17
2025-12-28 19:23:01,1586861147103-01,Barbie | Personagens | Brinquedos | Bebês e Infantil | Primeira Infância,Laptop Infantil Bilíngue - Barbie CAN1812,9999,9999,1,7831,bumerangbrinquedos,2025-12-31 13:30:17
2025-12-28 19:20:04,1586861147098-01,Ventilador de teto | Eletrodomésticos,Ventilador De Teto Silencioso 3 Velocidades Luminária Led Controle Remoto Bivolt,17900,17900,1,1207961,webcontinentalmktplace,2025-12-31 13:30:17
2025-12-28 19:20:04,1586861147098-03,Toalhas de Banho e Rosto | Cama e Banho | Casa e Cozinha,Toalha De Banho Loft Por Cor Camesa Azul UN,6499,12999,1,299035,rovitex,2025-12-31 13:30:17
2025-12-28 19:20:04,1586861147098-02,"Formas | Assadeiras, Fôrmas e Travessas | Casa e Cozinha",Conjunto de travessas refratárias marinex em vidro - 10 peças,11990,13900,1,2135902,loyalt,2025-12-31 13:30:18
2025-12-28 19:20:04,1586861147098-04,"Talheres e Porta-Talheres | Louça, Copos e Talheres | Casa e Cozinha",Kit Talher Belize Preto 21PCS SIMONAGGIO,2995,3990,1,797375,minipreco,2025-12-31 13:30:18
2025-12-28 19:20:04,1586861147098-04,"Jogos de Copos e Taças Mistos | Louça, Copos e Talheres | Casa e Cozinha",Copo de Vidro 240ML - MAHALO,395,999,10,1190713,minipreco,2025-12-31 13:30:18
2025-12-28 19:16:58,1586861147097-01,Equipamentos de Jardinagem | Jardim e Exteriores | Casa e Cozinha,"Roçadeira gasolina 25,4cc rgo260 vonder",74390,74390,1,2104153,loyalt,2025-12-31 13:30:18
2025-12-28 19:12:21,1586861147095-02,Higiene do Bebê | Bebês e Infantil,Troninho infantil ploc rosa - voyage,9260,10290,1,2042532,loyalt,2025-12-31 13:30:18
2025-12-28 19:12:21,1586861147095-01,Tablets | Eletrônicos,"Tablet Infantil Lcd Lousa Mágica Desenha Estuda Escrever - 8,5 Polegadas",4289,4289,1,1972124,webcontinentalmktplace,2025-12-31 13:30:19
2025-12-28 19:12:16,1586861147094-01,Panelas e Utensílios para Cozinhar | Casa e Cozinha,POTE CONECT RT DEC 370ML B5 15039 PLASUTIL,749,749,2,812970,minipreco,2025-12-31 13:30:19
2025-12-28 19:12:16,1586861147094-01,"Utensílios para Servir | Louça, Copos e Talheres | Casa e Cozinha",SALEIRO DEC 100ML 16545 PLASUTIL,499,499,1,1284152,minipreco,2025-12-31 13:30:19
2025-12-28 19:12:16,1586861147094-01,"Tigelas | Louça, Copos e Talheres | Casa e Cozinha",TIGELA LISA PRETA 800ML 2001-8 ALVES,449,449,1,866354,minipreco,2025-12-31 13:30:19
2025-12-28 19:06:54,1586861147092-01,Cortadores e Moedores | Utensílios para Cozinha | Casa e Cozinha,Triturador Picador Alho Cebola Vinagrete Com Cordinha Manual,2990,2990,1,1688764,webcontinentalmktplace,2025-12-31 13:30:19
2025-12-28 19:06:54,1586861147092-01,Potes | Utensílios para Cozinha | Casa e Cozinha,Jogo Com 5 Potes De Vidro Guarda Mantimentos,3890,3890,1,1651611,webcontinentalmktplace,2025-12-31 13:30:19
2025-12-28 19:06:54,1586861147092-01,Climatizador | Eletroportáteis,Climatizador Philco 5L Display Touch 5 em 1 PCL10QF 110V,87990,87990,1,1832748,webcontinentalmktplace,2025-12-31 13:30:19
2025-12-28 19:00:44,1586861147090-01,Cadeiras para Escritório | Escritório | Móveis,Cadeira Gamer Stillus Ergonômica Com Apoio Para Os Pés - Vermelho,53499,53499,1,1820382,webcontinentalmktplace,2025-12-31 13:30:19
2025-12-28 18:45:58,1586861147085-01,"Liquidificadores | Liquidificadores, Batedeiras e Processadores | Eletroportáteis",Liquidificador Britânia BLQ1380P Pro Maxx 6 Inox 3L 1200W 127V,15990,19990,1,18045,Philco,2025-12-31 13:30:19
2025-12-28 18:44:37,1586861147084-01,Cabos | Computadores e Informática,"Adaptador Hub Type C 8x1 Hdmi 4k, Lan, Usb 3.0, Leitor Sd Para Macbook",8989,8989,1,1159057,webcontinentalmktplace,2025-12-31 13:30:20
2025-12-28 18:44:37,1586861147084-01,Interruptores e Reguladores | Elétrica | Materiais de Construção,Benjamim Adaptador Universal Tomada Usb Tipo C Filtro Linha,9900,9900,1,1269360,webcontinentalmktplace,2025-12-31 13:30:20
2025-12-28 18:23:44,1586851147078-01,Tablets | Eletrônicos,"Tablet Positivo Vision Tab 10 4GB RAM 128GB Câmera 13MP e 5MP 10,1"" HD IPS Android 13 - Preto",87900,129900,1,313921,lojapositivo,2025-12-31 13:30:20
2025-12-28 18:21:59,1586851147077-01,Fones de Ouvido | Celulares e Smartphones,Fone De Ouvido Airdots Bluetooth 5.0 Sem Fio In-ear Com Cancelamento De Ruído E Microfone Embutido,2990,2990,2,1216592,webcontinentalmktplace,2025-12-31 13:30:20
2025-12-28 18:00:58,1586851147064-01,Ventiladores | Eletroportáteis,Ventilador Britânia BVT301 Tecnologia Maxx Force 60W 127V,9490,19990,2,155335,Philco,2025-12-31 13:30:21
2025-12-28 17:55:05,1586851147062-01,Ventiladores | Eletroportáteis,Ventilador Britânia BVT301 Tecnologia Maxx Force 60W 127V,9490,19990,2,155335,Philco,2025-12-31 13:30:21
2025-12-28 17:54:50,1586851147061-01,"Bebedouros | Filtros, Bebedouros e Refrigeradores de Água | Eletroportáteis",Bebedouro Philco PBE14 10L e 20L Duas temperaturas Bivolt Bivolt,29990,41990,1,229737,Philco,2025-12-31 13:30:21
2025-12-28 17:53:31,1586851147060-01,Fones de Ouvido | Celulares e Smartphones,Fone de Ouvido Headphone Bluetooth Micro Sd Mp3 Rádio Fm Preto,6489,6489,1,1135006,webcontinentalmktplace,2025-12-31 13:30:21
2025-12-28 17:50:46,1586851147058-01,Secador de Cabelo | Cuidados com o Cabelo | Cosméticos e Perfumaria,Secador de Cabelo Cadence Rouge Style II Vermelho/Preto 220 V,13590,16990,1,462936,webcontinentalmktplace,2025-12-31 13:30:22
2025-12-28 17:50:46,1586851147059-01,Praia e Parque | Esporte e Lazer,BOIA INFLAVEL INFANTIL PRANCHA 58165 MIMO,6990,6990,1,813388,minipreco,2025-12-31 13:30:22
2025-12-28 17:50:46,1586851147059-01,Praia e Parque | Esporte e Lazer,BOTE INFLAVEL INTEX EXPLORER 200 58331 MIMO,19990,19990,1,813225,minipreco,2025-12-31 13:30:22
2025-12-28 17:49:36,1586851147055-02,Acessórios Para Quarto | Quarto | Móveis,Cama Box Base Casal Universal Suede Black (138x188x20) - Costa Rica,30291,30291,1,1434337,webcontinentalmktplace,2025-12-31 13:30:22
2025-12-28 17:49:36,1586851147055-01,Bicicletas | Bicicleta e Ciclismo | Esporte e Lazer,Bicicleta Paradise Aro 26 com Cesta Free Action Black Cooper S/V,94900,109990,1,1965864,multilojaonline,2025-12-31 13:30:22
2025-12-28 17:49:02,1586851147054-01,Sistemas de som | Produtos automotivos,Som Automotivo Pionner Bluetooth Usb Fm Mvh-145br Preto,40840,40840,1,1967338,webcontinentalmktplace,2025-12-31 13:30:23
2025-12-28 17:45:29,1586851147050-01,"Caixas de Som Portáteis | Áudio | Cinema, TV e Áudio",Caixa De Som Amplificada Mondial Connect Lights Preto E Vermelho 700W RMS CM-700 Bivolt,71000,71000,1,1807542,webcontinentalmktplace,2025-12-31 13:30:23
2025-12-28 17:39:09,1586851147047-02,Smartphone | Celulares e Smartphones,Relogio Smartwatch Camera Celular Chip Cartao Musica Rosa,14990,14990,1,1384006,webcontinentalmktplace,2025-12-31 13:30:23
2025-12-28 17:39:09,1586851147047-01,Smartphone | Celulares e Smartphones,Celular samsung galaxy a07 tela 6.7” 256gb 4gb 90hz câmera dupla 50mp preto,84900,98111,1,2045348,loyalt,2025-12-31 13:30:23
2025-12-28 17:36:27,1586851147046-01,Ar-condicionado | Eletrodomésticos,Ar-Condicionado Split  9000 BTU/h Prime Air 9FC Frio 220V,169990,249990,1,1811950,Philco,2025-12-31 13:30:24
2025-12-28 17:32:41,1586851147041-01,Celulares e Smartphones,"Smartphone motorola moto g06 4g tela 6,9” 128gb câmera 50mp azul marinho",64900,66000,1,2047097,loyalt,2025-12-31 13:30:24
2025-12-28 17:30:38,1586851147030-01,"Formas | Assadeiras, Fôrmas e Travessas | Casa e Cozinha",Conjunto de travessas refratárias marinex em vidro - 10 peças,11990,13900,1,2135902,loyalt,2025-12-31 13:30:24
2025-12-28 17:29:32,1586841147029-01,Fones sem fio | Fones de Ouvido | Celulares e Smartphones,Fone De Ouvido Tws Bluetooth Branco,10490,22900,1,49769,funstock,2025-12-31 13:30:25
2025-12-28 17:22:41,1586841147024-01,Fornos Elétricos | Eletrodomésticos,Forno Elétrico De Embutir Digital Mueller 50 Litros Espelhado MFE50L 220V,161910,179900,1,1986776,webcontinentalmktplace,2025-12-31 13:30:25
2025-12-28 17:21:51,1586841147022-01,Máquinas de Lavar Roupas | Máquinas de Lavar e Secadoras | Eletrodomésticos,Lavadora de roupas consul 12kg cwh12bb com dosagem econômica e ciclo edredom – branca,174900,198836,1,2046695,loyalt,2025-12-31 13:30:25
2025-12-28 17:05:03,1586841147015-01,Produto Update,Cervejeira Philco PCV142P Display Digital 3 em 1 91L 220V,259990,337990,1,111978,Philco,2025-12-31 13:30:26
2025-12-28 16:57:02,1586841147013-01,Ventiladores | Eletroportáteis,Ventilador de Coluna Britânia BVT450 Maxx Force 160W 127V,18990,36990,1,155224,Philco,2025-12-31 13:30:26
2025-12-28 16:50:40,1586841147010-01,"TVs | Cinema, TV e Áudio",Smart TV 40” Philco PTV40M9GACGB LED Android TV Dolby Audio Bivolt,159990,206990,1,1570013,Philco,2025-12-31 13:30:26
2025-12-28 16:41:25,1586841147009-01,Ventiladores | Eletroportáteis,Ventilador Britânia BVT301 Tecnologia Maxx Force 60W 127V,9490,19990,2,155335,Philco,2025-12-31 13:30:26
2025-12-28 16:39:39,1586841147007-01,Celulares e Smartphones,"Smartphone motorola moto g06 4g tela 6,9” 128gb câmera 50mp azul marinho",64900,66000,1,2047097,loyalt,2025-12-31 13:30:26
2025-12-28 16:38:26,1586841147006-01,Panelas e Utensílios para Cozinhar | Casa e Cozinha,Copo Térmico Electrolux 560ml Verde Sense com Tampa Hermetica,7990,7990,1,1108018,electrolux,2025-12-31 13:30:26
2025-12-28 16:37:39,1586841147005-01,"Multiprocessador | Liquidificadores, Batedeiras e Processadores | Eletroportáteis",Mini Processador Amvox Triturador APR 1001 100W Vermelho 127V,9990,9990,1,71680,qcompra,2025-12-31 13:30:26
2025-12-28 16:25:11,1586831146998-01,Ar-condicionado | Eletrodomésticos,Ar Condicionado Portátil HQ 10.500 BTUs Frio Monofásico Branco HQ-AP10500FW 127V,183222,183222,1,1282870,webcontinentalmktplace,2025-12-31 13:30:26
2025-12-28 16:23:24,1586831146997-01,Guarda-Roupa E Roupeiros | Quarto | Móveis,Guarda Roupa Casal Hera Premium Com Espelho 8 Portas Moderna Naturalle/off White,148990,164990,1,2226262,webcontinentalmktplace,2025-12-31 13:30:27
2025-12-28 16:15:08,1586831146991-01,Escadas | Ferramentas Manuais | Materiais de Construção,Escada Alumínio 3 Degraus Polipropileno Azul 005101 Mor,9990,14990,1,53800,minipreco,2025-12-31 13:30:27
2025-12-28 16:13:49,1586831146984-03,Estojos | Material Escolar | Papelaria,"Mochila Masculina Executiva Reforçada Para Trabalho, Viagem E Notebook 17`` Impermeável Usb - Mse - Cruzeiro Mse 8",11990,11990,1,2398177,webcontinentalmktplace,2025-12-31 13:30:27
2025-12-28 16:13:49,1586831146984-02,Instrumentos Musicais | Meninos | Brinquedos,Suporte para violão/guitarra/contrabaixo g3s1 ask,9490,9490,1,2084079,loyalt,2025-12-31 13:30:27
2025-12-28 16:13:49,1586831146984-01,Ventiladores | Eletroportáteis,Ventilador de Coluna Britânia BVT450 Maxx Force 160W 220V,18990,36990,1,155224,Philco,2025-12-31 13:30:27
2025-12-28 16:12:18,1586831146982-01,Ventiladores | Eletroportáteis,Ventilador Prime Air 160W Grade de 48cm AVTE450 127V,20990,25990,1,714173,Philco,2025-12-31 13:30:27
2025-12-28 16:11:38,1586831146981-01,Smartphone | Celulares e Smartphones,USADO Motorola Moto G52 128 GB Branco Bom,67900,67900,1,1281035,armazemcircular,2025-12-31 13:30:27
2025-12-28 16:03:00,1586831146973-01,Torradeiras | Eletroportáteis,Torradeira Elétrica Electrolux Inox Experience com 7 Níveis de Tostagem (ETS25) 127V,17990,31990,1,1107202,electrolux,2025-12-31 13:30:27
2025-12-28 16:02:15,1586831146969-01,Piscinas e Acessórios | Jardim e Exteriores | Casa e Cozinha,Piscina Inflável 1400 Litros Redonda Splash Fun Mor,19251,19251,1,1654469,webcontinentalmktplace,2025-12-31 13:30:27
2025-12-28 16:01:59,1586831146968-01,Malas | Bolsas e Mochilas,Mala De Bordo ABS Para Viagem IKA Vanguard Cadeado Integrado Rodas Duplas 360º Branco P,21290,21290,1,1536678,webcontinentalmktplace,2025-12-31 13:30:27
2025-12-28 15:53:11,1586831146965-01,"Suplementos | Vitaminas, Minerais e Suplementos | Saúde e Bem Estar","WHEY 100% HD REFIL BLACK SKULL - 900G (WPC, WPI E WPH) REFIL WHEY 100% HD COOKIES 900G",13990,13990,1,768803,blackskullusa,2025-12-31 13:30:28
2025-12-28 15:52:04,1586831146963-02,Mesas Para Escritório / Escrivaninha | Escritório | Móveis,Mesa para Computador Gamer em L 3 Gavetas Branco/Rustic Lisboa Madesa Cor:Branco/Rustic,57999,67999,1,1512106,madesacms,2025-12-31 13:30:28
2025-12-28 15:52:04,1586831146963-01,Luzes e Luminárias de Parede | Iluminação | Materiais de Construção,Luminária G Rgb Com Relógio Carregador Por Indução Abajur Inteligente E Caixa De Som - Branco,15990,15990,1,1174902,webcontinentalmktplace,2025-12-31 13:30:28
2025-12-28 15:52:04,1586831146963-01,Cadeiras para Escritório | Escritório | Móveis,Cadeira Office Eiffel Slim Com Base Giratória E Ajustável Branco,25999,28999,1,1953802,webcontinentalmktplace,2025-12-31 13:30:28
2025-12-28 15:51:01,1586831146962-01,"Liquidificadores | Liquidificadores, Batedeiras e Processadores | Eletroportáteis",Liquidificador Britânia Diamante Preto 900W 127V,9990,21990,1,1911,Philco,2025-12-31 13:30:28
2025-12-28 15:51:01,1586831146962-01,Ventiladores | Eletroportáteis,Ventilador Britânia BVT301 Tecnologia Maxx Force 60W 127V,9490,19990,1,155335,Philco,2025-12-31 13:30:28
2025-12-28 15:48:37,1586831146960-01,Circulador de ar | Eletroportáteis,"Climatizador De Ar Oster Portátil 4 Em 1 5,3L 110V",46900,64990,1,1810218,webcontinentalmktplace,2025-12-31 13:30:28
2025-12-28 15:48:02,1586831146959-01,Impressoras | Impressoras e Acessórios | Computadores e Informática,Impressora Multifuncional HP Deskjet Ink Advantaje 2874 Preto Bivolt,55990,58990,1,743363,multilojaonline,2025-12-31 13:30:28
