creationDate,orderId,categoryName,name,price,listPrice,quantity,productId,seller,data_extracao
2026-01-16 10:40:44,1603741155604-01,Cadeiras De Jantar | Sala de Jantar | Móveis,Cadeira Para Mesa De Jantar Liz Mdf Kit 4 Peças Freijó Linho Palha – Leifer Móveis,82775,82775,1,2529190,webcontinentalmktplace,2026-01-19 16:24:57
2026-01-16 10:39:02,1603741155602-01,Shampoos e Condicionadores | Higiene | Saúde e Bem Estar,Shampoo TRESemmé Reconstrução e Força - 650ml,4990,4990,1,415672,farmaciaindiana,2026-01-19 16:24:57
2026-01-16 10:39:02,1603741155602-02,Fritadeiras Elétricas | Eletroportáteis,"Fritadeira Air Fryer Britânia 4,2L 1500W BFR38 Dura Mais 127V",21990,30990,1,419530,Philco,2026-01-19 16:24:57
2026-01-16 10:23:17,1603731155590-01,Panelas de Arroz | Eletroportáteis Especiais | Eletroportáteis,Panela de Arroz BPA10PI XI75 10 Xícaras 127V,16990,31990,1,1000,Philco,2026-01-19 16:24:57
2026-01-16 10:16:14,1603731155588-01,Enxoval | Bebês e Infantil,Fronha Baby Em Malha Estampada 1Pç Vivaldi Cinza UN,994,1999,1,63449,rovitex,2026-01-19 16:24:58
2026-01-16 10:16:14,1603731155588-01,Enxoval | Bebês e Infantil,Lençol Baby Em Malha Lisa 1Pç Vivaldi Rosa UN,2499,3499,1,106290,rovitex,2026-01-19 16:24:58
2026-01-16 10:16:14,1603731155588-01,Enxoval | Bebês e Infantil,Manta Baby Dupla Vivaldi Cinza UN,3499,6999,1,62969,rovitex,2026-01-19 16:24:58
2026-01-16 10:16:14,1603731155588-01,Higiene do Bebê | Bebês e Infantil,Kit Três Panos de Boca Vivaldi Rosa UN,1350,2999,1,2456944,rovitex,2026-01-19 16:24:58
2026-01-16 10:16:14,1603731155588-02,Higiene do Bebê | Bebês e Infantil,Naninha Para Meninas Coral Fleece 100% Poliéster 27x27cm Elefante Rosa,2290,2290,1,2143557,webcontinentalmktplace,2026-01-19 16:24:59
2026-01-16 10:03:15,1603731155587-01,Ventiladores | Eletroportáteis,Ventilador Britânia 2 em 1 BVT400 Maxx Force 150W 127V,12990,20990,1,155222,Philco,2026-01-19 16:24:59
2026-01-16 09:46:54,1603731155583-01,Mochilas | Bolsas e Mochilas,MOCHILA INFANTIL STITCH VERDE IS41531SC-VD MAXLOG,12990,12990,1,846700,minipreco,2026-01-19 16:24:59
2026-01-16 09:46:54,1603731155583-01,Caderno | Escrita | Papelaria,Caderno Brochura 1/4 Capa Dura Stitch 80 Folhas - FORONI,1499,1499,1,1221237,minipreco,2026-01-19 16:24:59
2026-01-16 09:46:54,1603731155583-01,Massas de modelar | Meninas | Brinquedos,MASSINHA MODELAR SOFT BRANCO 500G 073500418 ACRILEX,1699,1699,1,795914,minipreco,2026-01-19 16:24:59
2026-01-16 09:46:54,1603731155583-01,Massas de modelar | Meninas | Brinquedos,MASSINHA MODELAR SOFT VIOLETA 500G 073500516 ACRILEX,1699,1699,1,795898,minipreco,2026-01-19 16:24:59
2026-01-16 09:46:54,1603731155583-01,Escrita | Papelaria,TELA PINTURA ESCOLAR 15X15 MDF 8300 SOUZA,599,599,1,2332393,minipreco,2026-01-19 16:24:59
2026-01-16 09:46:54,1603731155583-02,Infantil - Artes | Infantil | Livros,LIVRO ATIVIDADE COLOR SET CANDY A4,1490,1490,1,2504576,martinsfontespaulista,2026-01-19 16:24:59
2026-01-16 09:36:23,1603731155579-01,Cadernos e Agendas | Papelaria,Caderno Inteligente A5 Arco íris Pastel 80 Folhas Cia52060 - Ci,9059,9059,1,2275894,webcontinentalmktplace,2026-01-19 16:25:00
2026-01-16 09:18:57,1603721155575-01,Anticoncepcional | Saúde Da Mulher | Medicamentos,Elani 28 Caixa 28 Comprimidos Revestidos,7499,9692,1,1201453,farmaconde,2026-01-19 16:25:00
2026-01-16 09:18:57,1603721155575-01,Pressão Alta | Cardiológicos | Medicamentos,Selozok 25Mg C/ 60 Comprimidos AstraZeneca SELOZOK 25MG 60CP LIB PROL ASTRAZENECA,6859,8469,1,727624,farmaconde,2026-01-19 16:25:00
2026-01-16 09:04:35,1603721155573-01,Guarda-Roupa E Roupeiros | Quarto | Móveis,Guarda Roupa Solteiro 6 Portas 2 Gavetas Sidney Doripel Preto S/V,49990,65990,1,250111,multilojaonline,2026-01-19 16:25:00
2026-01-16 09:02:10,1603721155572-01,"Café, Chá e Expresso | Eletroportáteis",Cafeteira Italiana Moka Alumínio Prepara Até 6 Xícaras Café Expresso,6291,6291,1,1456114,webcontinentalmktplace,2026-01-19 16:25:00
2026-01-16 08:26:54,1603711155569-01,"Processadores de Alimentos | Liquidificadores, Batedeiras e Processadores | Eletroportáteis",Mini Processador De Alimentos Com Função Pulsar Branco 110V,20990,20990,1,2330250,webcontinentalmktplace,2026-01-19 16:25:01
2026-01-16 08:17:54,1603711155566-01,Ferramentas Elétricas | Materiais de Construção,"Lavadora de alta pressão wap eco fit 2200 1500psi 1400w com jato de Água leque e concentrado, sistema stop total - amarelo/preta",34900,44900,1,2048175,loyalt,2026-01-19 16:25:01
2026-01-16 07:53:34,1603711155562-01,Ventiladores | Eletroportáteis,Ventilador de Coluna Britânia BVT450 Maxx Force 160W 220V,18990,36990,1,155224,Philco,2026-01-19 16:25:01
2026-01-16 07:48:17,1603711155561-01,Potes | Utensílios para Cozinha | Casa e Cozinha,Potes Herméticos Electrolux de Plástico Branco Retangular com 10 Unidades,8490,15900,1,1108205,electrolux,2026-01-19 16:25:02
2026-01-16 07:43:52,1603711155560-01,"Liquidificadores | Liquidificadores, Batedeiras e Processadores | Eletroportáteis",Liquidificador Britânia Diamante Preto 900W 127V,9990,18990,1,1911,Philco,2026-01-19 16:25:02
2026-01-16 07:42:42,1603711155559-01,Smartwatches | Eletrônicos,Smartwatch Multi G2R GPS Proteção IP67 Preto - WR208 WR208,44900,44900,1,791222,compreja,2026-01-19 16:25:02
2026-01-16 07:09:30,1603701155556-01,Potes | Utensílios para Cozinha | Casa e Cozinha,Potes Herméticos Electrolux de Plástico Cinza Escuro Retangular com 8 Unidades,6490,6900,1,1108053,electrolux,2026-01-19 16:25:03
2026-01-16 07:00:58,1603701155555-01,Praia e Parque | Esporte e Lazer,Piscina Infantil 1000l Mor Retangular Verão - Casa Dos Fogões,19690,19690,1,1103912,webcontinentalmktplace,2026-01-19 16:25:03
2026-01-16 06:33:35,1603701155552-01,Cooktops | Fogões e Cooktops | Eletrodomésticos,Cooktop Atlas 5 Bocas Ágile Up Mesa de Vidro Preto Bivolt,39990,49990,1,1965338,multilojaonline,2026-01-19 16:25:03
2026-01-16 06:33:35,1603701155552-02,"Mixers | Liquidificadores, Batedeiras e Processadores | Eletroportáteis",Mixer Britânia BMX350P 350W Lâminas PRO MAXX 220V,8990,15990,1,910,Philco,2026-01-19 16:25:03
2026-01-16 06:00:31,1603691155551-01,Potes | Utensílios para Cozinha | Casa e Cozinha,Potes Herméticos Porta-Mantimentos com Tampa de Bambu,9990,11200,1,1107933,electrolux,2026-01-19 16:25:04
2026-01-16 05:53:43,1603691155549-01,Sanduicheiras e Grelhas Elétricas | Eletroportáteis,Sanduicheira e Grill Britânia BGR27I Press 2 em 1 850W 127V,10990,20990,1,7570,Philco,2026-01-19 16:25:04
2026-01-16 02:55:32,1603661155542-01,Bolsas e Mochilas,Mochila Para Notebook Executiva Spartan Isiway Psm1600100 Preto U,6090,6090,1,1137830,webcontinentalmktplace,2026-01-19 16:25:04
2026-01-16 01:45:33,1603651155540-02,Aspiradores de Pó e Água | Eletroportáteis,Aspirador de Pó Vertical e Portátil - Black+Decker - Ciclônico - 1200W - 127V,31090,41400,1,2477165,funstock,2026-01-19 16:25:04
2026-01-16 01:45:33,1603651155540-01,Escova Rotativa Modeladora | Cuidados com o Cabelo | Cosméticos e Perfumaria,Escova Rotativa Britânia Bivolt 1300W Opção Secador BERE01 Bivolt,15990,21990,1,1999700,Philco,2026-01-19 16:25:05
2026-01-16 01:40:41,1603651155539-01,Chupetas e Mordedores | Bebês e Infantil,Mordedor Pais e Filhos Galinha Pintadinha,2519,2799,1,1202200,farmaconde,2026-01-19 16:25:05
2026-01-16 01:40:41,1603651155539-01,Amamentação e Alimentação | Bebês e Infantil,Aptamil 2 Premium Lata 800g,7099,7099,1,1196503,farmaconde,2026-01-19 16:25:05
2026-01-16 01:40:30,1603651155538-01,"Liquidificadores | Liquidificadores, Batedeiras e Processadores | Eletroportáteis",Liquidificador Britânia Diamante Preto 900W 220V,9990,18990,1,1911,Philco,2026-01-19 16:25:05
2026-01-16 01:40:30,1603651155538-01,Chapinhas e Pranchas | Cuidados com o Cabelo | Cosméticos e Perfumaria,Prancha Britânia Linha Viih Tube Bivolt 230°C BPR04 Bivolt,12990,21990,1,1569985,Philco,2026-01-19 16:25:05
2026-01-16 01:20:20,1603641155536-01,Quarto Infantil | Quarto | Móveis,Treliche Juvenil com escada Betina Mobikasa Branco/Legno Salinas S/V,200590,229990,1,2481209,multilojaonline,2026-01-19 16:25:06
2026-01-16 01:08:12,1603641155534-01,Travesseiros | Cama e Banho | Casa e Cozinha,Travesseiro Altenburg Gelatto Suporte Médio 48x70cm,13190,13190,2,2432505,webcontinentalmktplace,2026-01-19 16:25:06
2026-01-16 01:08:12,1603641155534-02,Cama e Banho | Casa e Cozinha,"Cortina Isa Varão Tecido Oxford 2,80m x 2,30m p/ Porta Balcão - Cinza",12734,12734,1,1408854,shophub,2026-01-19 16:25:06
2026-01-16 00:37:00,1603641155531-01,Ventiladores | Eletroportáteis,Ventilador de Coluna Britânia BVT450 Maxx Force 160W 220V,18990,36990,1,155224,Philco,2026-01-19 16:25:06
2026-01-16 00:30:07,1603641155530-01,Shampoos e Condicionadores | Higiene | Saúde e Bem Estar,Kit Cadiveu Essentials Quartzo Shine Shampoo 250ml + Condicionador 250ml + Sérum 65ml,9590,10990,1,2332881,farmaciaindiana,2026-01-19 16:25:07
2026-01-16 00:30:07,1603641155530-01,Cuidados com o Cabelo | Cosméticos e Perfumaria,Óleo de Tratamento Capilar Cadiveu Professional Essentials Açaí Oil 60ml,9799,9799,1,2333247,farmaciaindiana,2026-01-19 16:25:07
2026-01-16 00:21:43,1603631155528-02,"Sabonetes Líquidos, Óleos e Loções | Corpo e Banho | Cosméticos e Perfumaria",Sabonete Líquido Infantil Granado 250ml Erva Doce SAB LIQ INF GRANADO,2899,3247,1,725107,farmaconde,2026-01-19 16:25:07
2026-01-16 00:21:43,1603631155528-01,Fralda Geriátrica | Cuidado Adulto | Saúde e Bem Estar,Roupa Íntima Descartável Tena Pants Confort G/EG 32 unidades,9980,13790,1,1189781,farmaciaindiana,2026-01-19 16:25:07
2026-01-16 00:21:43,1603631155528-01,Lenço Umedecido | Higiene | Saúde e Bem Estar,Lenço Umedecido Personal Baby 50 Unidades,1199,1299,1,848434,farmaciaindiana,2026-01-19 16:25:07
2026-01-16 00:14:50,1603631155527-01,Ventiladores | Eletroportáteis,Ventilador de Coluna Britânia BVT450 Maxx Force 160W 127V,18990,36990,2,155224,Philco,2026-01-19 16:25:07
2026-01-16 00:14:50,1603631155527-01,Secador de Cabelo | Cuidados com o Cabelo | Cosméticos e Perfumaria,Secador de Cabelos Philco Bivolt 2200W PSC2450 Íons Tourmaline Bivolt,10990,21990,1,1264491,Philco,2026-01-19 16:25:07
2026-01-16 00:13:18,1603631155523-01,Colchões | Quarto | Móveis,Colchão P/Berço Espuma D18 60x130x07cm Advanced Baby Cinza,9899,9899,1,1457794,webcontinentalmktplace,2026-01-19 16:25:08
2026-01-16 00:03:10,1603631155518-01,Depuradores e Coifas | Eletrodomésticos,Depurador De Ar Suggar 60Cm Di61Pt Preto 110V (7908312809614),65088,65088,1,2536789,webcontinentalmktplace,2026-01-19 16:25:08
2026-01-15 23:34:06,1603631155517-01,Climatizador | Eletroportáteis,Climatizador Britânia 4 em 1 Autonomia de 26h BCL05A 220V,36990,52990,1,1268197,Philco,2026-01-19 16:25:08
2026-01-15 23:19:03,1603621155515-01,Fritadeiras Elétricas | Eletroportáteis,Air Fryer Oven Philco PFR2200 4 em 1 Preta 127V,59990,69990,1,17905,Philco,2026-01-19 16:25:09
2026-01-15 23:00:09,1603621155514-01,Panelas Elétricas | Eletroportáteis Especiais | Eletroportáteis,"Panela Philco PPH280ACR Redstone com Tampa de Vidro 6,1L -",23490,34990,1,155126,Philco,2026-01-19 16:25:09
2026-01-15 23:00:09,1603621155514-01,Panelas Elétricas | Eletroportáteis Especiais | Eletroportáteis,"Panela Philco PPN24A Redstone com Tampa de Vidro 4,6L Bivolt",21490,30990,1,705850,Philco,2026-01-19 16:25:09
2026-01-15 22:57:05,1603621155513-01,Mochilas | Bolsas e Mochilas,LANCHEIRA INFANTIL MASCULINA HOT WHEELS PRETA LA39153HW-PT MAXLOG,7999,7999,1,783758,minipreco,2026-01-19 16:25:09
2026-01-15 22:57:05,1603621155513-01,Mochilas | Bolsas e Mochilas,MOCHILA RODAS INFANTIL MASCULINA HOT WHEELS PRETA IC39152HW-PT MAXLOG,19990,19990,1,783944,minipreco,2026-01-19 16:25:09
2026-01-15 22:53:30,1603621155512-01,Fritadeiras Elétricas | Eletroportáteis,"Air Fryer Electrolux 5,6L Efficient por Rita Lobo (EAF41) 220V",29990,49990,1,1260176,electrolux,2026-01-19 16:25:09
2026-01-15 22:52:09,1603621155511-01,Ventiladores | Eletroportáteis,Ventilador Britânia 2 em 1 BVT400 Maxx Force 150W 127V,12990,20990,1,155222,Philco,2026-01-19 16:25:10
2026-01-15 22:50:10,1603621155508-01,Torradeiras | Eletroportáteis,Torradeira Philco French Toast Inox 900W 127V,11490,15990,1,1692,Philco,2026-01-19 16:25:10
2026-01-15 22:48:56,1603621155507-01,Perfumes | Cosméticos e Perfumaria,Mixed emotions linn young - perfume feminino - eau de parfum,11619,11619,1,2050742,loyalt,2026-01-19 16:25:10
2026-01-15 22:48:53,1603621155506-01,Cuidados com o Cabelo | Cosméticos e Perfumaria,Wella professionals fusion kit shampoo + máscara,20786,34000,1,2069187,loyalt,2026-01-19 16:25:11
2026-01-15 22:45:39,1603621155505-01,"Batedeiras | Liquidificadores, Batedeiras e Processadores | Eletroportáteis",Batedeira Philco Planetária PHP500 Turbo 220V,27990,52990,1,131059,Philco,2026-01-19 16:25:11
2026-01-15 22:38:51,1603621155502-01,Artigos Gamer | Computadores e Informática,Video Game Portátil X6 Jogos Nintendo Sega Gba Nes Mp3 Preto,17500,17500,1,2467878,webcontinentalmktplace,2026-01-19 16:25:11
2026-01-15 22:37:47,1603621155501-01,"Bebedouros | Filtros, Bebedouros e Refrigeradores de Água | Eletroportáteis",Bebedouro Britânia BBE13B Aquaplus para 10L ou 20L Bivolt Bivolt,29990,52990,1,113813,Philco,2026-01-19 16:25:11
2026-01-15 22:37:32,1603621155500-01,Acessórios Automotivos | Produtos automotivos,Hard Wax Cera Automotiva Cadillac -300g C- Aplic,11482,11482,1,1122127,webcontinentalmktplace,2026-01-19 16:25:12
2026-01-15 22:30:23,1603621155497-01,Umidificador | Eletroportáteis,Umidificador de Ar Portátil USB 130ml - Western Home,3590,6700,1,1226573,funstock,2026-01-19 16:25:12
2026-01-15 22:30:23,1603621155497-02,"Aparelhos de Jantar | Louça, Copos e Talheres | Casa e Cozinha",Jogo De Prato Fundo 6 Unidades Vidro Resistente Duralex - Nadir,3843,3843,1,1905707,webcontinentalmktplace,2026-01-19 16:25:13
2026-01-15 22:26:58,1603611155495-01,Potes | Utensílios para Cozinha | Casa e Cozinha,Potes Herméticos Electrolux de Plástico Cinza Escuro Retangular com 8 Unidades,6490,6900,1,1108053,electrolux,2026-01-19 16:25:13
2026-01-15 22:20:57,1603611155492-01,Cadeiras para Escritório | Escritório | Móveis,Cadeira Gamer Fox Racer Vulpes Cinza WZ-318,54433,54433,1,1939691,webcontinentalmktplace,2026-01-19 16:25:14
2026-01-15 22:17:00,1603611155489-01,"Formas | Assadeiras, Fôrmas e Travessas | Casa e Cozinha",Conjunto de travessas refratárias marinex em vidro - 10 peças,11990,13900,1,2135902,loyalt,2026-01-19 16:25:14
2026-01-15 22:16:18,1603611155487-01,Ventiladores | Eletroportáteis,Ventilador Britânia BVT301 Tecnologia Maxx Force 60W 127V,10990,19990,1,155335,Philco,2026-01-19 16:25:14
2026-01-15 22:13:59,1603611155486-01,Escova Rotativa Modeladora | Cuidados com o Cabelo | Cosméticos e Perfumaria,Cacheador Philco Duo Shine Rosa Bivolt,12990,16990,1,155349,Philco,2026-01-19 16:25:15
2026-01-15 22:13:12,1603611155485-01,Multiuso | Móveis,Armário Multiuso 2 Portas New Aramóveis  Atacama/Off White S/V,20990,22990,1,253188,multilojaonline,2026-01-19 16:25:15
2026-01-15 21:49:40,1603611155475-01,Aspiradores Robô | Aspiradores de Pó e Água | Eletroportáteis,Robô Aspirador de Pó Electrolux 3 em 1 com Sensor Antiqueda Experience até 2h20 min Cinza (ERB20) Bivolt,54990,98990,1,1108177,electrolux,2026-01-19 16:25:15
2026-01-15 21:48:46,1603611155474-01,Motorola | Smartphone | Celulares e Smartphones,Smartphone Motorola Moto G15 256GB 12GB de RAM Verde,94900,109900,1,1330562,webfones,2026-01-19 16:25:15
2026-01-15 21:44:49,1603611155472-01,Praia e Parque | Esporte e Lazer,Piscina Infantil 1000l Mor Retangular Verão - Casa Dos Fogões,19690,19690,1,1103912,webcontinentalmktplace,2026-01-19 16:25:16
2026-01-15 21:44:23,1603611155471-01,Aspiradores de Pó e Água | Eletroportáteis,Aspirador de Pó Vertical com Fio Electrolux 1100W 2 em 1 Filtro HEPA Azul (STK13A) 220V,14990,25990,1,1107439,electrolux,2026-01-19 16:25:16
2026-01-15 21:40:31,1603611155469-01,Smartwatches | Eletrônicos,Smartwatch Positivo Watch Essential IP68 até 10 dias de Bateria Tela IPS Monitoramento 1.83” - Preto,21900,49900,1,856218,lojapositivo,2026-01-19 16:25:16
2026-01-15 21:38:38,1603611155465-03,Cuidados com o Cabelo | Cosméticos e Perfumaria,Lola cosmetics pinga kit Óleo – açai e pracaxi + cenoura e oliva + patauá e moringa,6290,13470,1,2073907,loyalt,2026-01-19 16:25:16
2026-01-15 21:38:38,1603611155465-01,Corpo e Banho | Cosméticos e Perfumaria,Rosa Selvagem Clareador De Pele Contra Manchas E Estrias 100ml,8590,11176,1,1281988,pensefarma,2026-01-19 16:25:17
2026-01-15 21:38:38,1603611155465-02,Rosto | Maquiagem | Cosméticos e Perfumaria,LA ROCHE CICAPLAST BAUME B5 20ML,4599,5490,1,731760,farmaciaindiana,2026-01-19 16:25:17
2026-01-15 21:38:38,1603611155465-02,Xiaomi | Smartphone | Celulares e Smartphones,Smartphone Xiaomi Redmi 14C Azul 256GB+4GB Ram,149900,179858,1,1259522,farmaciaindiana,2026-01-19 16:25:17
2026-01-15 21:37:10,1603611155462-02,"Processadores de Alimentos | Liquidificadores, Batedeiras e Processadores | Eletroportáteis",Multiprocessador de alimentos mondial turbo chef 9 em 1 mpn-01-bf 2 velocidades + pulsar 1000 w,32490,36645,1,2047072,loyalt,2026-01-19 16:25:17
2026-01-15 21:37:10,1603611155462-01,Ventiladores | Eletroportáteis,Ventilador Britânia BVT301 Tecnologia Maxx Force 60W 220V,10990,19990,1,155335,Philco,2026-01-19 16:25:17
2026-01-15 21:37:10,1603611155462-03,Fones de Ouvido | Celulares e Smartphones,Fone Bluetooth M10 Sem Fio Display Powerbank Fone Preto,2990,2990,2,1906116,webcontinentalmktplace,2026-01-19 16:25:18
2026-01-15 21:34:25,1603611155461-01,Cooktops | Fogões e Cooktops | Eletrodomésticos,Cooktop Atlas 5 Bocas Ágile Up Mesa de Vidro Preto Bivolt,39990,49990,1,1965338,multilojaonline,2026-01-19 16:25:18
2026-01-15 21:34:16,1603611155460-01,Ventiladores | Eletroportáteis,Ventilador Britânia BVT301 Tecnologia Maxx Force 60W 127V,10990,19990,1,155335,Philco,2026-01-19 16:25:18
2026-01-15 21:30:30,1603611155458-01,Ventiladores | Eletroportáteis,Ventilador de Coluna Britânia BVT450 Maxx Force 160W 127V,18990,36990,1,155224,Philco,2026-01-19 16:25:18
2026-01-15 21:22:54,1603601155456-01,Mochilas | Bolsas e Mochilas,MOCHILA JUVENIL FEMININA RB ROSA RB24548 SEMAX,24999,24999,1,795738,minipreco,2026-01-19 16:25:19
2026-01-15 21:22:54,1603601155456-01,Estojos | Bolsas e Mochilas,ESTOJO CASE RB LILAS 1 ZIP RB24591 SEMAX,7490,7490,1,795729,minipreco,2026-01-19 16:25:19
2026-01-15 21:22:04,1603601155455-01,Ventiladores | Eletroportáteis,Ventilador Britânia BVT301 Tecnologia Maxx Force 60W 127V,10990,19990,1,155335,Philco,2026-01-19 16:25:19
2026-01-15 21:20:55,1603601155454-01,Ventiladores | Eletroportáteis,Ventilador Prime Air 160W Grade de 48cm AVTE450 127V,20990,25990,1,714173,Philco,2026-01-19 16:25:19
2026-01-15 21:19:20,1603601155453-01,Samsung | Smartphone | Celulares e Smartphones,Smartphone Samsung Galaxy A16 128GB 4GB de RAM Preto,82900,94900,1,1962248,webfones,2026-01-19 16:25:20
2026-01-15 21:19:11,1603601155452-01,Ventiladores | Eletroportáteis,Ventilador Britânia BVT301 Tecnologia Maxx Force 60W 127V,10990,19990,1,155335,Philco,2026-01-19 16:25:20
2026-01-15 21:18:13,1603601155450-01,Fogões | Fogões e Cooktops | Eletrodomésticos,Fogão 4Q Atlas Mônaco Plus Acendimento Branco Mesa Inox Bivolt,62990,77990,1,42842,multilojaonline,2026-01-19 16:25:20
2026-01-15 21:16:45,1603601155449-01,Ar-condicionado | Eletrodomésticos,Ar-Condicionado Janela 10000BTUs Philco Frio PAJ10FA 220V,189990,249990,1,2082582,Philco,2026-01-19 16:25:20
2026-01-15 21:05:37,1603601155443-01,Aspiradores de Pó e Água | Eletroportáteis,Aspirador de Pó Britânia Bas1430 1250W 127V,21990,25990,1,759,Philco,2026-01-19 16:25:21
2026-01-15 21:05:37,1603601155443-01,Sanduicheiras e Grelhas Elétricas | Eletroportáteis,Sanduicheira e Grill Britânia BGR27I Press 2 em 1 850W 127V,10990,20990,1,7570,Philco,2026-01-19 16:25:21
2026-01-15 21:05:37,1603601155443-02,Coolers | Utensílios para Cozinha | Casa e Cozinha,Caixa Térmica Suv 32l Termolar Azul Tech único,16035,16035,1,1718563,webcontinentalmktplace,2026-01-19 16:25:21
2026-01-15 21:01:38,1603601155442-01,Ventiladores | Eletroportáteis,Ventilador de Coluna Britânia BVT450 Maxx Force 160W 127V,18990,36990,1,155224,Philco,2026-01-19 16:25:21
2026-01-15 20:59:33,1603601155441-01,Notebooks | Notebooks e Acessórios | Computadores e Informática,Notebook Positivo Vision C14 Lumina BAR Intel® Celeron® N4500 Windows 11 Home 8GB RAM 128GB eMMC 14” HD Tecla Link Cinza,189900,399900,1,1957465,lojapositivo,2026-01-19 16:25:22
2026-01-15 20:56:51,1603601155438-01,Ventiladores | Eletroportáteis,Ventilador Britânia 2 em 1 BVT400 Maxx Force 150W 127V,12990,20990,1,155222,Philco,2026-01-19 16:25:22
2026-01-15 20:55:54,1603601155437-01,Aspiradores de Pó e Água | Eletroportáteis,Aspirador de Pó Vertical com Fio Electrolux 1450W 2 em 1 Filtro HEPA Branco (STK14B) 127V,16990,30990,1,1108180,electrolux,2026-01-19 16:25:22
2026-01-15 20:54:55,1603601155436-01,Fritadeiras Elétricas | Eletroportáteis,Air Fryer Oven Philco PFR2200 4 em 1 Preta 220V,59990,69990,1,17905,Philco,2026-01-19 16:25:23
2026-01-15 20:45:12,1603601155431-01,Ventiladores | Eletroportáteis,Ventilador Britânia BVT301 Tecnologia Maxx Force 60W 220V,10990,19990,1,155335,Philco,2026-01-19 16:25:23
2026-01-15 20:44:30,1603601155430-01,Motorola | Smartphone | Celulares e Smartphones,Smartphone Motorola Moto G35 5G 256GB 12GB de RAM Coral,107900,129900,1,1455312,webfones,2026-01-19 16:25:23
2026-01-15 20:43:46,1603601155429-01,Smartphone | Celulares e Smartphones,Smartphone Realme Note 50 4gb Ram 128gb Preto,89900,89900,1,1286310,webcontinentalmktplace,2026-01-19 16:25:23
2026-01-15 20:40:39,1603601155426-01,Bicicleta e Ciclismo | Esporte e Lazer,Bicicleta ergométrica spinning magnética gallant elite roda de inércia 13 kg (gsb13hmga-pt),219900,219900,1,2051640,loyalt,2026-01-19 16:25:24
2026-01-15 20:36:56,1603601155424-01,Fritadeiras Elétricas | Eletroportáteis,Fritadeira elétrica sem Óleo air fryer oven 2 em 1 mondial afon-12l-bi 12l digital – preta/inox,54700,58790,1,2047081,loyalt,2026-01-19 16:25:24
2026-01-15 20:33:47,1603601155423-01,Ventiladores | Eletroportáteis,Ventilador Britânia BVT301 Tecnologia Maxx Force 60W 127V,10990,19990,1,155335,Philco,2026-01-19 16:25:24
2026-01-15 20:30:36,1603601155420-01,Furadeira | Ferramentas Elétricas | Materiais de Construção,Parafusadeira/furadeira A Bateria Vonder PFV120 12V Bivolt,28990,28990,1,859984,guimepa,2026-01-19 16:25:24
2026-01-15 20:28:32,1603591155419-01,Panelas | Panelas e Utensílios para Cozinhar | Casa e Cozinha,Jogo de Panelas Tramontina Linz 4 Peças em Aluminio Antiaderente Starflon Max Rosa,18795,18795,1,820610,marinbrasil,2026-01-19 16:25:25
2026-01-15 20:24:31,1603591155413-01,Pet Shop,Ração Cachorro Quatree Gourmet Raças Pequenas Adulto 3Kg,4590,5890,1,836573,farmaciaindiana,2026-01-19 16:25:25
2026-01-15 20:24:31,1603591155413-01,Ração e Petiscos | Pet Shop,Sachê Pedigree para Cães Adultos Sortido com Sabores Carne e Frango ao Molho 100g com 5 Unidades,1599,1680,1,2120965,farmaciaindiana,2026-01-19 16:25:25
2026-01-15 20:24:31,1603591155413-02,Ventiladores | Eletroportáteis,Ventilador Britânia BVT301 Tecnologia Maxx Force 60W 220V,10990,19990,1,155335,Philco,2026-01-19 16:25:25
2026-01-15 20:23:05,1603591155411-01,Ventiladores | Eletroportáteis,Ventilador de Coluna Britânia BVT450 Maxx Force 160W 127V,18990,36990,1,155224,Philco,2026-01-19 16:25:25
2026-01-15 20:11:18,1603591155406-01,"Chaleiras Elétricas | Café, Chá e Expresso | Eletroportáteis","Chaleira Elétrica Britânia BCH02PI 1,8L 127V",9990,15990,1,956,Philco,2026-01-19 16:25:26
2026-01-15 20:10:52,1603591155405-01,Ventiladores | Eletroportáteis,Ventilador Britânia BVT301 Tecnologia Maxx Force 60W 220V,10990,19990,2,155335,Philco,2026-01-19 16:25:26
2026-01-15 20:09:12,1603591155403-01,Ventiladores | Eletroportáteis,Ventilador Britânia 2 em 1 BVT400 Maxx Force 150W 220V,12990,20990,1,155222,Philco,2026-01-19 16:25:26
2026-01-15 20:08:46,1603591155401-01,Anticoncepcional | Saúde Da Mulher | Medicamentos,Triquilar Caixa 63 Drágeas,3037,3926,1,2456456,farmaconde,2026-01-19 16:25:27
2026-01-15 20:08:46,1603591155401-02,Eletroportáteis,Ventilador Oscilante de Coluna Turbo 30cm Preto 127V Premium Ventisol,24390,32500,2,811979,funstock,2026-01-19 16:25:27
2026-01-15 20:04:03,1603591155400-01,"TVs | Cinema, TV e Áudio","Smart tv 4k lg 43"" uhd 43ua7500psa processador a7 gen8 alexa integrado otimizador de jogos",179900,209890,1,2046120,loyalt,2026-01-19 16:25:28
2026-01-15 20:03:57,1603591155399-01,Praia e Parque | Esporte e Lazer,CARRINHO PRAIA MULTIUSO BOTAFOGO,22990,22990,1,2254011,minipreco,2026-01-19 16:25:28
2026-01-15 20:00:15,1603591155397-01,Centrífugas de suco e alimento | Espremedores e Centrífugas | Eletroportáteis,Espremedor de frutas mondial premium e-02 - preto,5990,6990,1,2045149,loyalt,2026-01-19 16:25:28
2026-01-15 19:59:16,1603591155396-01,Cremes e Máscaras pra cabelo | Cuidados com o Cabelo | Cosméticos e Perfumaria,Creme Pentear Seda Boom Definição Óleo de Coco 1KG,2499,2999,1,837700,farmaciaindiana,2026-01-19 16:25:28
2026-01-15 19:54:07,1603591155395-01,Pipoqueiras | Eletroportáteis,Pipoqueira Britânia Pop Time 220V,14990,25990,1,806,Philco,2026-01-19 16:25:29
2026-01-15 19:52:05,1603591155392-01,Ventiladores | Eletroportáteis,Ventilador de Coluna Britânia BVT450 Maxx Force 160W 127V,18990,36990,1,155224,Philco,2026-01-19 16:25:29
2026-01-15 19:50:36,1603591155391-01,Roupa de Cama | Cama e Banho | Casa e Cozinha,Jogo de Cama Chevron Queen Lar E Lazer Preto UN,6999,11499,1,1631709,rovitex,2026-01-19 16:25:29
2026-01-15 19:45:54,1603591155388-01,Sanduicheiras e Grelhas Elétricas | Eletroportáteis,Sanduicheira Elétrica Cadence Click 110V,11490,11490,1,1777975,webcontinentalmktplace,2026-01-19 16:25:30
