creationDate,orderId,categoryName,name,price,listPrice,quantity,productId,seller,data_extracao
2026-01-07 19:57:30,1601671151577-01,Toalhas de Banho e Rosto | Cama e Banho | Casa e Cozinha,Jogo de Toalha Zaya Petala de Rosa 2 Peças - ATLANTICA,5990,5990,1,1240267,minipreco,2026-01-08 11:57:01
2026-01-07 19:57:30,1601671151577-01,Toalhas de Banho e Rosto | Cama e Banho | Casa e Cozinha,Jogo de Toalha Zaya Azul 2 Peças - ATLANTICA,5990,5990,1,1240289,minipreco,2026-01-08 11:57:01
2026-01-07 19:57:30,1601671151577-01,Toalhas de Banho e Rosto | Cama e Banho | Casa e Cozinha,Toalha de Banho Nancy Verde 65X135CM Fatex,3490,3490,2,1285498,minipreco,2026-01-08 11:57:01
2026-01-07 19:30:29,1601671151568-01,Fraldas | Bebês e Infantil,Fraldas Turma da Mônica Baby XG 42 Unidades FR TURMA DA MONICA BABY XG 42UN,4249,5599,2,724622,farmaciaindiana,2026-01-08 11:57:02
2026-01-07 19:30:29,1601671151568-01,Fraldas | Bebês e Infantil,Fralda Babysec Premium Hiper Tamanho XXG 52 Unidades,6990,7990,1,831752,farmaciaindiana,2026-01-08 11:57:02
2026-01-07 19:23:48,1601661151565-01,Fones de Ouvido | Celulares e Smartphones,Fone Ouvido Bluetooth Par I7s Tws sem Fio V4.2 Case Base,6289,6289,1,1921957,webcontinentalmktplace,2026-01-08 11:57:02
2026-01-07 19:19:45,1601661151563-01,Motorola | Smartphone | Celulares e Smartphones,Smartphone Motorola Moto G15 256GB 12GB de RAM Grafite,82900,109900,1,1330562,webfones,2026-01-08 11:57:02
2026-01-07 19:06:47,1601661151560-01,"Aparelhos de Jantar | Louça, Copos e Talheres | Casa e Cozinha",Jogo De Prato Fundo 6 Unidades Vidro Resistente Duralex - Nadir,3821,3821,2,1653298,webcontinentalmktplace,2026-01-08 11:57:03
2026-01-07 19:06:47,1601661151560-01,"Talheres e Porta-Talheres | Louça, Copos e Talheres | Casa e Cozinha",Jogo De Talher Faqueiro Ipanema Aço Inox 24 Peças Tramontina Vermelho,7205,7205,1,1664165,webcontinentalmktplace,2026-01-08 11:57:03
2026-01-07 19:06:47,1601661151560-01,Casa e Cozinha,Jogo De Taça Vidro Milbali Art House Bali 6 Taças 320ml Zein Grafite,6990,6990,1,2442066,webcontinentalmktplace,2026-01-08 11:57:03
2026-01-07 19:03:44,1601661151558-01,"Áudio | Cinema, TV e Áudio",Headphone jbl tune 520bt - azul,24200,24999,1,2046975,loyalt,2026-01-08 11:57:03
2026-01-07 18:57:54,1601661151553-01,Para Cozinha | Balanças Eletrônicas | Eletroportáteis,Balança Digital De Alta Precisão Para Cozinha Tramontina Adatto Com Base Em Aço Inox,19845,19845,1,1655717,marinbrasil,2026-01-08 11:57:03
2026-01-07 18:57:54,1601661151553-03,"Bebedouros | Filtros, Bebedouros e Refrigeradores de Água | Eletroportáteis",Filtro de Água Philco Tecnologia Acqua Fresh PFA01A Bivolt,12990,14990,1,2267745,Philco,2026-01-08 11:57:04
2026-01-07 18:57:54,1601661151553-02,Pipoqueiras | Eletroportáteis,Pipoqueira Mondial Popflix Branco PP-04 127V,19990,19990,2,1129425,webcontinentalmktplace,2026-01-08 11:57:04
2026-01-07 18:44:19,1601661151550-01,"Cafeteiras e Máquinas de Expresso | Café, Chá e Expresso | Eletroportáteis",Cafeteira Elétrica Electrolux 30 Xícaras Efficient Função Manter Aquecido Cor Inox Preta (ECM20) 220V,14990,20990,1,1107437,electrolux,2026-01-08 11:57:04
2026-01-07 18:31:41,1601661151545-01,Ventiladores | Eletroportáteis,Ventilador Arno Coluna 40cm Xtreme Force Preto VB4C 127V,40368,40368,1,825972,webcontinental,2026-01-08 11:57:04
2026-01-07 18:31:41,1601661151545-02,Tablets | Eletrônicos,"Tablet samsung galaxy s10 lite 10.9"" android 15 128gb exynos 1380 wi-fi 8mp caneta s pen capa protetora cinza",199900,261059,1,2045051,loyalt,2026-01-08 11:57:05
2026-01-07 18:29:06,1601651151544-01,Motorola | Smartphone | Celulares e Smartphones,Smartphone Motorola Moto G35 5G 256GB 12GB de RAM Coral,94900,154900,1,1455312,webfones,2026-01-08 11:57:05
2026-01-07 18:23:45,1601651151539-01,Mochilas | Bolsas e Mochilas,MOCHILA NOTEBOOK PRETO CABO ACO MN4176 BF BRASIL,14999,14999,1,1730302,minipreco,2026-01-08 11:57:05
2026-01-07 18:22:00,1601651151538-01,Aspiradores de Pó e Água | Eletroportáteis,Aspirador Pó e Água Electrolux 1400w 18L Smart com Função Sopro Cinza (A10N1) 220V,24990,27990,1,1108011,electrolux,2026-01-08 11:57:06
2026-01-07 18:18:17,1601651151534-01,"Mixers | Liquidificadores, Batedeiras e Processadores | Eletroportáteis",Mixer 3 em 1 Electrolux Preto 400W com Tecnologia TruFlow (EIB10) 220V,18990,31990,1,1107399,electrolux,2026-01-08 11:57:06
2026-01-07 18:16:37,1601651151533-01,Carros de passeio | Pneus | Produtos automotivos,Pneu Aro 14 175/65R14 82T F-600 Firestone,31498,31498,1,817913,pneubarato,2026-01-08 11:57:06
2026-01-07 18:12:20,1601651151532-01,Smartphone | Celulares e Smartphones,USADO iPhone X 256 GB Cinza Espacial Muito Bom,119700,119700,1,1223894,armazemcircular,2026-01-08 11:57:07
2026-01-07 17:59:13,1601651151525-01,Limpeza Doméstica | Casa e Cozinha,Papa Bolinhas Elétrico Verde Recarregável Usb Removedor De Fiapos E Pelos,3290,3290,1,2309068,webcontinentalmktplace,2026-01-08 11:57:07
2026-01-07 17:57:08,1601651151522-01,"Liquidificadores | Liquidificadores, Batedeiras e Processadores | Eletroportáteis","Liquidificador oster 1400w full preto 3,2l - oliq610",22990,24045,1,2045318,loyalt,2026-01-08 11:57:07
2026-01-07 17:57:08,1601651151522-02,Aspiradores de Pó e Água | Eletroportáteis,Aspirador de Pó Vertical com Fio Electrolux 1450W 2 em 1 Filtro HEPA Branco (STK14B) 127V,19990,30990,1,1108180,electrolux,2026-01-08 11:57:08
2026-01-07 17:57:08,1601651151522-03,Ventiladores | Eletroportáteis,Ventilador Prime Air 160W Grade de 48cm AVTE450 127V,20990,25990,1,714173,Philco,2026-01-08 11:57:08
2026-01-07 17:50:20,1601651151520-01,Fornos de Micro-Ondas | Eletrodomésticos,Micro-ondas Electrolux 23L Preto Efficient com Descongelamento Assistido (ME23P) 220V,59900,79900,1,1107324,electrolux,2026-01-08 11:57:08
2026-01-07 17:43:50,1601651151519-01,Cozinha Industrial | Eletrodomésticos,Panquequeira De Ferro Cabo De Madeira Panela Mineira 24x2cm,12952,12952,1,2362158,webcontinentalmktplace,2026-01-08 11:57:08
2026-01-07 17:34:36,1601651151512-01,"Suplementos | Vitaminas, Minerais e Suplementos | Saúde e Bem Estar",Creatina - Max Titanium - 300g,6980,8990,1,139622,farmaciaindiana,2026-01-08 11:57:09
2026-01-07 17:26:41,1601641151511-01,"Liquidificadores | Liquidificadores, Batedeiras e Processadores | Eletroportáteis","Liquidificador electrolux ebl1500 efficient triforce 1500w 3,2l cinza",18900,26145,1,2045266,loyalt,2026-01-08 11:57:09
2026-01-07 17:19:05,1601641151510-01,Ar-condicionado | Eletrodomésticos,Ventilador de mesa 40cm mondial super turbo vtx-40-8p 8 pás 3 velocidades preto,18500,22040,1,2044915,loyalt,2026-01-08 11:57:09
2026-01-07 17:11:59,1601641151509-01,Climatizador | Eletroportáteis,Climatizador Britânia 4 em 1 Autonomia de 26h BCL05A 127V,50990,52990,1,1268197,Philco,2026-01-08 11:57:10
2026-01-07 17:10:15,1601641151508-01,Motorola | Smartphone | Celulares e Smartphones,Smartphone Motorola Moto G15 256GB 12GB de RAM Grafite,82900,109900,1,1330562,webfones,2026-01-08 11:57:10
2026-01-07 17:04:52,1601641151506-01,"Cafeteiras e Máquinas de Expresso | Café, Chá e Expresso | Eletroportáteis",Cafeteira expresso arno dolce gusto genio s plus dgs2 - preta,53900,64900,1,2045097,loyalt,2026-01-08 11:57:11
2026-01-07 17:04:52,1601641151506-01,Pipoqueiras | Eletroportáteis,Pipoqueira britânia poplite bpi01 110v,17590,17590,1,2072398,loyalt,2026-01-08 11:57:11
2026-01-07 17:02:25,1601641151505-01,Ar-condicionado | Eletrodomésticos,Ventilador de mesa 40cm mondial super turbo vtx-40-8p 8 pás 3 velocidades preto,18500,22040,1,2044915,loyalt,2026-01-08 11:57:11
2026-01-07 17:01:45,1601641151504-01,Smartphone | Celulares e Smartphones,Smartphone Infinix Smart 10 - 4GB RAM 256GB - Câmera 8MP + IA - 6.67” HD+ 120Hz - Bateria 5000mAh - Dual Chip - Preto,89900,139900,1,2013761,lojapositivo,2026-01-08 11:57:11
2026-01-07 16:59:03,1601641151499-01,Porta-Condimento | Utensílios para Cozinha | Casa e Cozinha,Porta Condimentos de Vidro Lyor Borossilicato com Tampa e Suporte de Aço Preto com 8 Peças,7371,7371,1,74685,webcontinentalmktplace,2026-01-08 11:57:12
2026-01-07 16:59:03,1601641151499-03,Panelas | Panelas e Utensílios para Cozinhar | Casa e Cozinha,"Frigideira Wok Antiaderente com Tampa Grafite N24 2,8L - MTA",5990,12990,1,1757189,minipreco,2026-01-08 11:57:12
2026-01-07 16:59:03,1601641151499-02,Bicicleta e Ciclismo | Esporte e Lazer,Bicicleta ergométrica vertical gallant trainer (gbe1hbta-pt),58300,58300,1,2051840,loyalt,2026-01-08 11:57:12
2026-01-07 16:55:23,1601641151496-01,Pet Shop,"Ração Quatree Goumert 10,1KG Peixe Gatos Adultos",12791,14490,1,832487,farmaciaindiana,2026-01-08 11:57:12
2026-01-07 16:51:49,1601641151494-01,Celulares e Smartphones,"Smartphone motorola moto g06 4g tela 6,9” 128gb câmera 50mp azul marinho",77656,89920,2,2047097,loyalt,2026-01-08 11:57:13
2026-01-07 16:39:32,1601641151492-02,Fritadeiras Elétricas | Eletroportáteis,AIR FRYER BRITANIA OVEN 127V BFR2100P OSCAR,54928,54928,1,2236138,minipreco,2026-01-08 11:57:13
2026-01-07 16:39:32,1601641151492-01,Toalhas de Banho e Rosto | Cama e Banho | Casa e Cozinha,Kit 5 Toalhas De Banho Grossas Banhão 70 X 140 Montreal Beca Alta Absorção,14890,14890,1,1531204,webcontinentalmktplace,2026-01-08 11:57:13
2026-01-07 16:23:27,1601631151490-01,Fornos Elétricos | Eletrodomésticos,Forno Elétrico 49L Britânia BFE49 Dupla Resistência 110V,48390,48390,1,1778276,webcontinentalmktplace,2026-01-08 11:57:14
2026-01-07 16:15:07,1601631151489-01,Aspiradores de Pó e Água | Eletroportáteis,Aspirador de Pó Vertical com Fio Electrolux 1100W 2 em 1 Filtro HEPA Preto (STK12) 127V,17990,25990,1,1107436,electrolux,2026-01-08 11:57:14
2026-01-07 16:14:37,1601631151488-01,Aspiradores de Pó e Água | Eletroportáteis,Aspirador de Pó e Água Electrolux 1500W 12L com ThermoControl e Função Sopro Inox (GT12l) 127V,33990,54990,1,1107911,electrolux,2026-01-08 11:57:15
2026-01-07 16:14:10,1601631151487-01,"Vitaminas, Minerais e Suplementos | Saúde e Bem Estar",Whey Protein Concentrado Dux Baunilha 900g,16349,18999,1,835801,farmaconde,2026-01-08 11:57:15
2026-01-07 16:01:01,1601631151486-01,Motorola | Smartphone | Celulares e Smartphones,Smartphone Motorola Moto G35 5G 256GB 12GB de RAM Coral,94900,154900,1,1455312,webfones,2026-01-08 11:57:15
2026-01-07 15:53:48,1601631151485-01,Balcão | Cozinha | Móveis,Balcão Cantinho do Café Madesa Reims 2 Portas Cor:Preto,37999,83990,1,3433,madesacms,2026-01-08 11:57:15
2026-01-07 15:53:45,1601631151484-01,Cozinhas Completas | Cozinha | Móveis,Armário de Cozinha Completa Madesa Emilly 293001 com Balcão e Paneleiro Cor:Rustic/Preto,103999,199999,1,43145,madesacms,2026-01-08 11:57:16
2026-01-07 15:41:22,1601631151478-01,Ferramentas Elétricas | Materiais de Construção,Parafusadeira com Impacto 20V Com Maleta PFL-20CI Lynus,24990,24990,2,903075,guimepa,2026-01-08 11:57:17
2026-01-07 15:38:23,1601631151477-01,Ventiladores | Eletroportáteis,Ventilador Coluna Mondial - Turbo 06 Pás - Vt-30c-nb Vent 30cm Vt-30c-nb 127v/60hz Turbo Coluna,23490,23490,1,1905010,webcontinentalmktplace,2026-01-08 11:57:17
2026-01-07 15:37:06,1601631151475-01,Fornos de Micro-Ondas | Eletrodomésticos,Micro-ondas Electrolux 23L Preto Efficient com Descongelamento Assistido (ME23P) 127V,59900,79900,1,1107324,electrolux,2026-01-08 11:57:17
2026-01-07 15:30:56,1601631151472-01,Cozinha Industrial | Eletrodomésticos,Jogo 6 Canecas C-alça Colorida Borossilicato 450ml 11x8x8cm,13512,13512,1,2313217,webcontinentalmktplace,2026-01-08 11:57:18
2026-01-07 15:30:34,1601631151471-01,"Liquidificadores | Liquidificadores, Batedeiras e Processadores | Eletroportáteis","Liquidificador electrolux ebl1500 efficient triforce 1500w 3,2l cinza",18900,26145,1,2045266,loyalt,2026-01-08 11:57:18
2026-01-07 15:26:50,1601621151470-01,Ventiladores | Eletroportáteis,Ventilador Britânia BVT301 Tecnologia Maxx Force 60W 127V,18990,19990,1,155335,Philco,2026-01-08 11:57:18
2026-01-07 15:25:13,1601621151466-03,Decoração e Acessórios para Cozinha | Utensílios para Cozinha | Casa e Cozinha,Jogo de Utensílios Tramontina Ability em Nylon Preto 10 Peças,9345,14900,1,269743,marinbrasil,2026-01-08 11:57:18
2026-01-07 15:25:13,1601621151466-04,Potes | Utensílios para Cozinha | Casa e Cozinha,Potes Herméticos Electrolux de Plástico Cinza Retangular com 12 Unidades,9990,10900,1,1108208,electrolux,2026-01-08 11:57:19
2026-01-07 15:25:13,1601621151466-02,Cobertores e Mantas | Cama e Banho | Casa e Cozinha,KIT CAMA CRYSTAL CASAL ALGODAO RISQUE 3PCS 886080000092730 TEKA,9990,9990,1,781371,minipreco,2026-01-08 11:57:19
2026-01-07 15:25:13,1601621151466-01,Impressoras | Impressoras e Acessórios | Computadores e Informática,"Impressora Térmica Não Fiscal Jetway Jp 500, 1d E 2d, 230dpi, 200mm-s",64869,64869,1,1644990,webcontinentalmktplace,2026-01-08 11:57:20
2026-01-07 15:20:14,1601621151465-01,Motorola | Smartphone | Celulares e Smartphones,Smartphone Motorola Moto G56 5G 256GB 24GB de RAM Grafite,143900,143900,1,1965434,webfones,2026-01-08 11:57:20
2026-01-07 14:59:06,1601621151456-01,Roupa de Cama | Cama e Banho | Casa e Cozinha,Edredom Casal Fusion Vivaldi Azul UN,19592,33999,1,128168,rovitex,2026-01-08 11:57:20
2026-01-07 14:59:06,1601621151456-02,Roupa de Cama | Cama e Banho | Casa e Cozinha,Lençol Solteiro Cintilante Percal 180 Fios 100% Algodão Com Elástico - Palha,3480,3480,1,2431720,webcontinentalmktplace,2026-01-08 11:57:21
2026-01-07 14:46:22,1601621151453-01,Motorola | Smartphone | Celulares e Smartphones,Smartphone Motorola Moto G15 256GB 12GB de RAM Verde,82900,109900,1,1330562,webfones,2026-01-08 11:57:21
2026-01-07 14:46:01,1601621151452-01,Rosto | Pele | Cosméticos e Perfumaria,Hidratante Facial Antimanchas Garnier Vitamina C Toque Seco 85g,2829,3989,1,1241909,farmaciaindiana,2026-01-08 11:57:21
2026-01-07 14:43:34,1601621151449-01,Fornos Elétricos | Eletrodomésticos,Forno Elétrico Britânia 10L BFE11 2 Resistências 230° 127V,19990,23990,1,814832,Philco,2026-01-08 11:57:22
2026-01-07 14:42:10,1601621151447-01,Tablets | Eletrônicos,Tablet infantil multi skye patrulha canina 7” android 13 go nb422 quad-core wi-fi 64gb 2mp rosa,49900,60585,1,2045361,loyalt,2026-01-08 11:57:22
2026-01-07 14:37:14,1601621151446-01,Sanduicheiras e Grelhas Elétricas | Eletroportáteis,Sanduicheira Elétrica Cadence Click 110V,11490,11490,1,1777975,webcontinentalmktplace,2026-01-08 11:57:23
2026-01-07 14:36:20,1601621151445-01,Acessórios Geriátricos | Cuidado Adulto | Saúde e Bem Estar,Fixador de Dentadura Fixodent Original Creme 21g,3499,3499,1,1290529,farmaconde,2026-01-08 11:57:23
2026-01-07 14:32:48,1601621151444-01,Fornos de Micro-Ondas | Eletrodomésticos,Micro-ondas Midea 20L Branco e Preto 127V MRAS21,45900,45900,1,825764,webcontinental,2026-01-08 11:57:23
2026-01-07 14:30:20,1601621151441-01,"TVs | Cinema, TV e Áudio","Smart tv 75"" 4k tcl 75p6k google tv hdr10+ processador aipq",376100,449900,1,2046105,loyalt,2026-01-08 11:57:24
2026-01-07 14:11:54,1601611151432-01,"TVs | Cinema, TV e Áudio","Smart tv 43” samsung full hd un43f6000fgxzd, xbox cloud gaming, hdr, som em movimento virtual, ai energy mode, wi-fi e bluetooth",161200,194145,1,2046123,loyalt,2026-01-08 11:57:24
2026-01-07 14:05:15,1601611151431-01,Motorola | Smartphone | Celulares e Smartphones,Smartphone Motorola Moto G35 5G 256GB 12GB de RAM Coral,94900,154900,2,1455312,webfones,2026-01-08 11:57:24
2026-01-07 13:27:56,1601601151410-01,"Carregadores, Bases e Docking Stations para Notebo | Notebooks e Acessórios | Computadores e Informática",Carregador Portátil Power Bank 30.000mah Super Carga Rápida Preto,28289,28289,1,1159653,webcontinentalmktplace,2026-01-08 11:57:25
2026-01-07 13:27:47,1601601151409-01,Fornos Elétricos | Eletrodomésticos,Forno Elétrico Philco PFE44P Dupla Resistência 44L 127V,40990,49990,1,143109,Philco,2026-01-08 11:57:25
2026-01-07 13:27:04,1601601151408-01,Pet Shop,Ração Gato Whiskas Peixe 500g,2149,2299,6,834537,farmaciaindiana,2026-01-08 11:57:25
2026-01-07 13:25:47,1601601151407-01,Meninos | Brinquedos,Brinquedo Tiranossauro Rex Dino Com Luz Led Sons Movimentos Amarelo,7190,7190,1,2097100,webcontinentalmktplace,2026-01-08 11:57:25
2026-01-07 13:24:12,1601601151405-01,Motorola | Smartphone | Celulares e Smartphones,Smartphone Motorola Moto G15 256GB 12GB de RAM Verde,82900,109900,1,1330562,webfones,2026-01-08 11:57:26
2026-01-07 13:23:16,1601601151401-01,Bicicletas | Bicicleta e Ciclismo | Esporte e Lazer,Bicicleta Aro 20 Mono Meninas Rosa Com Rodinhas,56990,56990,1,1976061,webcontinentalmktplace,2026-01-08 11:57:26
2026-01-07 13:18:15,1601601151399-01,"TVs | Cinema, TV e Áudio","Smart tv 40"" philco full hd led ptv40m9gr2cgb com sistema operacional roku tv, dolby audio, processador quad-core, entradas usb e hdmi",115900,152824,1,2046127,loyalt,2026-01-08 11:57:26
2026-01-07 13:15:28,1601601151396-02,Fritadeiras Elétricas | Eletroportáteis,Fritadeira elétrica sem Óleo air fryer oven 2 em 1 mondial afon-12l-bi 12l digital – preta/inox,49900,58790,1,2047081,loyalt,2026-01-08 11:57:27
2026-01-07 13:15:28,1601601151396-01,"Café, Chá e Expresso | Eletroportáteis","Chaleira Elétrica MP Casa 127V 1,8 Litros",4990,8999,1,996214,minipreco,2026-01-08 11:57:27
2026-01-07 13:08:38,1601601151394-01,Samsung | Smartphone | Celulares e Smartphones,Smartphone Samsung Galaxy A16 128GB 4GB de RAM Cinza,84900,89900,1,1867810,webfones,2026-01-08 11:57:27
2026-01-07 13:00:43,1601601151393-01,Piscinas e Acessórios | Jardim e Exteriores | Casa e Cozinha,Piscina Standard Retangular PVC 1000 litros Mor,18042,28868,1,43301,tfdbn2,2026-01-08 11:57:27
2026-01-07 12:41:18,1601601151389-02,Tablets | Eletrônicos,Tablet Positivo Vision TAB 7 Stitch + Capa e Bolsa - Octa-Core 3GB RAM 64GB Android 14 Go Wi-Fi Tela 7” IPS – Preto,52900,89900,1,855372,lojapositivo,2026-01-08 11:57:28
2026-01-07 12:41:18,1601601151389-01,Celulares e Smartphones,"Celular samsung galaxy a56 tela super amoled 6.7"" 128gb 5g 50mp preto",194900,251663,1,2045356,loyalt,2026-01-08 11:57:28
2026-01-07 12:41:18,1601601151389-01,Celulares e Smartphones,"Celular motorola moto g86 tela 6,7” oled 512gb 5g câmera sony 50mp verde escuro",170900,249900,1,2137844,loyalt,2026-01-08 11:57:28
2026-01-07 12:41:18,1601601151389-01,Tablets | Eletrônicos,Tablet infantil multi chase patrulha canina 7” android 13 go nb421 quad-core wi-fi 64gb 2mp azul e vermelho,49900,57700,1,2045362,loyalt,2026-01-08 11:57:28
2026-01-07 12:30:15,1601601151386-01,Bolsas | Bolsas e Mochilas,Bolsa Feminina De Ombro Alice Palucci Preto UN,18999,22999,1,1720541,rovitex,2026-01-08 11:57:28
2026-01-07 12:27:53,1601591151383-01,"TVs | Cinema, TV e Áudio",Smart tv 32” philco led hd p32cra roku tv hdr dolby audio wi-fi dual band hdmi usb,80400,101895,2,2046128,loyalt,2026-01-08 11:57:29
2026-01-07 12:22:49,1601591151381-01,Samsung | Smartphone | Celulares e Smartphones,Smartphone Samsung Galaxy A16 128GB 4GB de RAM Cinza,84900,89900,1,1867810,webfones,2026-01-08 11:57:29
2026-01-07 12:19:16,1601591151378-01,Geladeiras | Geladeiras e Freezers | Eletrodomésticos,Geladeira Electrolux Cycle Defrost 240L Degelo Prático Uma Porta Branca (RE31) 220V,184900,239900,1,1107608,electrolux,2026-01-08 11:57:29
2026-01-07 12:16:53,1601591151377-01,"TVs | Cinema, TV e Áudio",Smart tv 32” philco led hd p32cra roku tv hdr dolby audio wi-fi dual band hdmi usb,80400,101895,1,2046128,loyalt,2026-01-08 11:57:29
2026-01-07 12:04:46,1601591151372-01,Carrinhos | Meninos | Brinquedos,Mini Moto Esportiva Elétrica - Amarela,61090,61090,1,1812450,webcontinentalmktplace,2026-01-08 11:57:30
2026-01-07 11:56:14,1601591151367-01,"Formas | Assadeiras, Fôrmas e Travessas | Casa e Cozinha",Conjunto de travessas refratárias marinex em vidro - 10 peças,11990,13900,1,2135902,loyalt,2026-01-08 11:57:30
2026-01-07 11:52:21,1601591151365-01,Fritadeiras Elétricas | Eletroportáteis,"Fritadeira air fryer electrolux eaf40 rita lobo 5,6l efficient 1400w antiaderente desligamento automático econômica cinza",31200,49900,1,2045302,loyalt,2026-01-08 11:57:30
2026-01-07 11:40:25,1601591151361-01,"Café, Chá e Expresso | Eletroportáteis","Chaleira Elétrica MP Casa 127V 1,8 Litros",4990,8999,1,996214,minipreco,2026-01-08 11:57:31
2026-01-07 11:40:23,1601591151360-01,Parafusadeiras | Ferramentas Elétricas | Materiais de Construção,"Parafusadeira Britânia 4,8V BPF01 200 RPM Bivolt",12990,16990,1,839,Philco,2026-01-08 11:57:31
2026-01-07 11:35:04,1601591151359-01,Desodorante | Higiene | Saúde e Bem Estar,Desodorante Dove Aerossol Masculino Men+Care 150ml,1999,1999,2,1205155,farmaconde,2026-01-08 11:57:31
2026-01-07 11:35:04,1601591151359-01,Cremes Dentais | Higiene Bucal | Higiene | Saúde e Bem Estar,Creme Dental Colgate Luminous White Glow 70g 2 Unidades,2899,3199,1,1275374,farmaconde,2026-01-08 11:57:31
2026-01-07 11:35:04,1601591151359-01,Cuidados com o Cabelo | Cosméticos e Perfumaria,Pente Concare Ondulado,309,439,2,2128990,farmaconde,2026-01-08 11:57:31
2026-01-07 11:26:49,1601581151357-01,Fornos de Micro-Ondas | Eletrodomésticos,Micro-ondas Philco 28 Litros Limpa Fácil 1100W Preto PMO30P 220V,54333,54333,1,1910469,webcontinentalmktplace,2026-01-08 11:57:32
2026-01-07 11:24:24,1601581151355-01,Protetores Solares e Bronzeadores | Pele | Cosméticos e Perfumaria,Kit Protetor Solar L'Oréal Solar Expertise Supreme Protect 4 FPS70 Frasco 200ml + Facial FPS60 Antioleosidade 25g Kit Protetor Solar L'Oréal Solar Expertise Supreme Protect 4 FPS70 Frasco 200ml + Facial FPS60 Antio,8299,8299,1,2439228,farmaconde,2026-01-08 11:57:32
2026-01-07 11:15:07,1601581151354-01,Água | Bebidas,Água Mineral Ingá Copo 200ml,94,99,1,2115694,farmaciaindiana,2026-01-08 11:57:32
2026-01-07 11:10:26,1601581151353-01,"Liquidificadores | Liquidificadores, Batedeiras e Processadores | Eletroportáteis","Liquidificador Electrolux 700w 1,5L Experience com Copo de Vidro e Tecnologia TruFlow™  Cor Inox Preto (EBS30) 127V",27990,41990,1,1107405,electrolux,2026-01-08 11:57:33
2026-01-07 10:59:57,1601581151349-01,Caneta | Escrita | Papelaria,CANETA ESFEROGRAFICA 1.0MM 4 EM 1 10249 LEONORA,690,690,1,843051,minipreco,2026-01-08 11:57:34
2026-01-07 10:53:17,1601581151345-01,Máquinas de Lavar Roupas | Máquinas de Lavar e Secadoras | Eletrodomésticos,Tanquinho de roupas britânia 10kg blr03 semiautomático - branco,44500,54512,1,2299613,loyalt,2026-01-08 11:57:34
2026-01-07 10:48:38,1601581151339-01,Potes | Utensílios para Cozinha | Casa e Cozinha,Potes Herméticos Porta-Mantimentos com Tampa de Bambu,10990,11200,2,1107933,electrolux,2026-01-08 11:57:34
2026-01-07 10:43:17,1601581151332-01,"Liquidificadores | Liquidificadores, Batedeiras e Processadores | Eletroportáteis","Liquidificador electrolux ebl1500 efficient triforce 1500w 3,2l cinza",18900,21527,1,2046778,loyalt,2026-01-08 11:57:34
2026-01-07 10:41:31,1601581151329-01,Utensílios para Cozinha | Casa e Cozinha,Máquina de waffle mondial pratic waffle gw-01,16890,17304,1,2047096,loyalt,2026-01-08 11:57:35
2026-01-07 10:41:31,1601581151329-02,Utilidades Domésticas | Casa e Cozinha,Piscina 1000 Litros  Mor,30391,30391,1,848530,farmaciaindiana,2026-01-08 11:57:35
2026-01-07 10:38:51,1601581151325-01,Smartwatches | Eletrônicos,Smartwatch Positivo Watch Essential IP68 até 10 dias de Bateria Tela IPS Monitoramento 1.83” - Preto,16900,49900,1,856218,lojapositivo,2026-01-08 11:57:36
2026-01-07 10:34:32,1601581151324-01,Motorola | Smartphone | Celulares e Smartphones,Motorola Moto G60S 128GB Azul Bom Usado,51777,51777,1,2036734,eurenovo,2026-01-08 11:57:36
2026-01-07 10:28:25,1601571151319-02,"Cafeteiras e Máquinas de Expresso | Café, Chá e Expresso | Eletroportáteis",Cafeteira Elétrica Gournet 15 Xícaras 127V 675W Preta Elgin,8913,8913,1,1044766,webcontinentalmktplace,2026-01-08 11:57:36
2026-01-07 10:28:25,1601571151319-01,Fritadeiras Elétricas | Eletroportáteis,"Fritadeira Air Fryer Britânia 4,2L 1500W BFR38 Dura Mais 127V",24990,30990,1,419530,Philco,2026-01-08 11:57:37
2026-01-07 10:27:10,1601571151318-01,Smartwatches | Eletrônicos,Smartwatch Positivo Watch Essential IP68 até 10 dias de Bateria Tela IPS Monitoramento 1.83” - Preto,16900,49900,1,856218,lojapositivo,2026-01-08 11:57:37
2026-01-07 10:26:28,1601571151317-01,Cremes Dentais | Higiene Bucal | Higiene | Saúde e Bem Estar,Creme Dental Colgate Luminous c/ 3 Unidades + Enxaguante Bucal,2499,2799,3,726016,farmaconde,2026-01-08 11:57:38
2026-01-07 10:21:56,1601571151316-01,Máquinas de Lavar Roupas | Máquinas de Lavar e Secadoras | Eletrodomésticos,"Máquina de Lavar Electrolux 8,5kg Branca Turbo Economia com Jet&Clean e Filtro Fiapos (LAC09) 220V",149900,221900,1,1107349,electrolux,2026-01-08 11:57:38
2026-01-07 10:17:37,1601571151315-01,Mochilas | Camping | Esporte e Lazer,Mochila Esportiva 30l Multifuncional Motoqueiro Viagens Camping Trilha Escolar preto,6990,6990,1,1836539,webcontinentalmktplace,2026-01-08 11:57:38
2026-01-07 10:02:13,1601571151310-01,"Vitaminas, Minerais e Suplementos | Saúde e Bem Estar",Nutri Whey Protein Refil Sabor Baunilha IntegralMédica 907G,9954,10135,1,1164224,pensefarma,2026-01-08 11:57:39
2026-01-07 09:57:55,1601571151309-01,Ventiladores | Eletroportáteis,Ventilador de Coluna Mondial NVT-40C-8P-B Turbo 40CM 8 Pás Preto 127V 3799-01,27636,27636,2,856113,webcontinental,2026-01-08 11:57:39
2026-01-07 09:55:57,1601571151304-02,"Pratos | Louça, Copos e Talheres | Casa e Cozinha",PRATO FUNDO 25CM BRANCO 21362BB ARK,690,690,4,797426,minipreco,2026-01-08 11:57:39
2026-01-07 09:55:57,1601571151304-03,Toalhas de Banho e Rosto | Cama e Banho | Casa e Cozinha,Toalha de Banho Decor Camesa Cinza UN,2580,6999,2,133815,rovitex,2026-01-08 11:57:40
2026-01-07 09:55:57,1601571151304-01,Sanduicheiras e Grelhas Elétricas | Eletroportáteis,Sanduicheira Mondial Fast Grill E Sandwich Preto S-12 127V,10990,10990,1,894203,webcontinentalmktplace,2026-01-08 11:57:40
